,StoreId,CompleteStoreName,FoodType,AverageRating,Reviewers,City,Location,District,Latitude,Longitude
1403,x4ev,Yes Natural Restaurant (Geylang),Noodles,4.9,100,Singapore,Geylang Singapore,14.0,1.3181862,103.8870563
1404,hbpb,Jiak Song Mee Hoon Kway (153 Serangoon),Noodles,4.2,57,Singapore,153 Serangoon Singapore,12.0,1.3700496,103.8726821
1405,iihv,Star Anise - Vietnamese Street Delights (Bukit Merah Central),Noodles,4.5,100,Singapore,Bukit Merah Central Singapore,,1.28291545,103.81677319439046
1406,q0at,Li Ji Chuan Chuan Xiang 李记串串香 (295 South Bridge Rd),Mala Xiang Guo,3.6,4,Singapore,295 South Bridge Rd Singapore,,1.28133275,103.8450142972355
1407,vjit,Chi-Bing (The Star Vista),Korean,4.5,100,Singapore,The Star Vista Singapore,,1.30683155,103.78842430820943
1408,leq3,Don Dae Bak (Kreta Ayer) - Islandwide Delivery,Korean,4.8,6,Singapore,Kreta Ayer Singapore,,1.2809005500000001,103.84282445439212
1409,hj0n,Hundred Acre Creamery Gelato (Irving Place),Beverages,5.0,2,Singapore,Irving Place Singapore,,1.3360323885647358,103.88641141179905
1410,x4hp,True Veggie (Geylang),Singaporean,4.6,500,Singapore,Geylang Singapore,14.0,1.3181862,103.8870563
1411,y6ae,Marutama Ramen (Kallang Leisure Park),Japanese,4.5,100,Singapore,Kallang Leisure Park Singapore,,1.3022347,103.87655441740489
1412,z1wc,Habib's Power Mee Stall (ABC Brickworks Food Centre),Malaysian,4.8,100,Singapore,ABC Brickworks Food Centre Singapore,,1.2868658,103.8081523
1413,ly44,Jin Yu Man Tang Dessert - 金玉满堂甜品 (291 South Bridge),Dessert,4.5,100,Singapore,291 South Bridge Singapore,,,
1414,ddo8,Hoppy Teppan Rice (440 Geylang Road),Japanese,4.5,7,Singapore,440 Geylang Road Singapore,14.0,1.3131599,103.88344230449252
1415,oleg,Second Serving (Tai Seng Point),Filipino,4.6,100,Singapore,Tai Seng Point Singapore,,1.3363873,103.88722183457944
1416,qxwk,Homeground Coffee Roasters (Tanjong Pagar),Coffee,4.3,17,Singapore,Tanjong Pagar Singapore,2.0,1.2764189,103.8429295
1417,mh2z,Chez Suzette (Teck Lim Road),French,2.2,5,Singapore,Teck Lim Road Singapore,,1.28018275,103.84195905
1418,bme6,Craftsmen Coffee (323 Alexandra),Coffee,5.0,5,Singapore,323 Alexandra Singapore,,1.2873591000000002,103.80539755573557
1419,m9zy,Geometry (Jalan Bukit Merah),Wraps,4.9,26,Singapore,Jalan Bukit Merah Singapore,,1.2778781386515055,103.83166574417798
1420,r6i2,Picotin Brewhaus (Rochester Drive),Italian,4.5,15,Singapore,Rochester Drive Singapore,,1.3059033413705683,103.78853055783463
1421,fca6,Milkbar (Circuit Road),Bubble Tea,4.0,24,Singapore,Circuit Road Singapore,,1.32486595,103.888705
1422,br3v,Jimmy Monkey Cafe & Bar (One North),International,5.0,4,Singapore,One North Singapore,,1.2995031,103.78729741855898
1423,daf8,Chingu Dining (Rochester Park),Korean,1.0,2,Singapore,Rochester Park Singapore,,1.30542415,103.78659107716888
1424,x4fz,Olive Mediterranean & Middle Eastern (Tai Seng Point),Wraps,4.6,100,Singapore,Tai Seng Point Singapore,,1.3363873,103.88722183457944
1425,b8l3,Chicky Fun (Hospital Crescent),Singaporean,4.5,3,Singapore,Hospital Crescent Singapore,,1.2780003434573415,103.83431725677558
1426,w7ou,Carrara Cafe (Jalan Bukit Merah),Singaporean,4.4,100,Singapore,Jalan Bukit Merah Singapore,,1.2778781386515055,103.83166574417798
1427,v0fp,Yanti Nasi Padang (Keong Saik),Indonesian,4.5,500,Singapore,Keong Saik Singapore,,1.3120964,103.7971925
1428,l8tl,Kobepi (Bukit Merah Swimming Complex),Japanese,3.3,4,Singapore,Bukit Merah Swimming Complex Singapore,,,
1429,nq67,Killiney (Keong Saik),Coffee,3.8,100,Singapore,Keong Saik Singapore,,1.3120964,103.7971925
1430,dffw,Hui Restaurant 汇 (Rochester),Chinese,5.0,12,Singapore,Rochester Singapore,,1.3055843,103.7865525
1431,i2uz,Breadlink (Jalan Bukit Merah),Dessert,4.4,100,Singapore,Jalan Bukit Merah Singapore,,1.2778781386515055,103.83166574417798
1432,v96g,Leckerbaer (Keong Saik),Burgers,5.0,13,Singapore,Keong Saik Singapore,,1.3120964,103.7971925
1433,txrb,Spice Table (South Bridge Road),Lebanese,3.8,2,Singapore,South Bridge Road Singapore,,1.28104152152305,103.84454560878986
1434,ngxp,Eatero (Geylang East Central),Chicken,4.5,100,Singapore,Geylang East Central Singapore,14.0,1.32027145,103.88738263636108
1435,ds97,Fieldnotes (Neil Road),Cakes,3.0,18,Singapore,Neil Road Singapore,,1.2796982533699017,103.84253965738871
1436,k7py,ACEITUNA MEXICANA TAI SENG POINT (Tai Seng Point),Chicken,4.2,100,Singapore,Tai Seng Point Singapore,,1.3363873,103.88722183457944
1437,sp7x,Dang Hong Pho (Rochester Park),Vietnamese,4.3,11,Singapore,Rochester Park Singapore,,1.30542415,103.78659107716888
1438,gwa1,The Viet Roti (601 MacPherson Rd),Vietnamese,4.5,77,Singapore,601 MacPherson Rd Singapore,13.0,1.3338724,103.8879254
1439,v4ag,Tasvee Restaurants (Geylang Road),Indian,4.3,3000,Singapore,Geylang Road Singapore,14.0,1.31241245,103.8779448
1440,xj0h,S.M.H Hot & Cold Drinks (Kadayanallur Street),Coffee,4.7,31,Singapore,Kadayanallur Street Singapore,,1.2799135379870659,103.84501845435258
1441,roiy,Jia Le Jia 佳乐家 (Maxwell Food Centre),Asian,4.0,2,Singapore,Maxwell Food Centre Singapore,,,
1442,a9vo,Meigui BBQ 玫瑰烤鱼 (Geylang East Central),Malaysian,4.9,17,Singapore,Geylang East Central Singapore,14.0,1.32027145,103.88738263636108
1443,gvx8,Yummy Punjaby (Alexandra Central) - Islandwide Delivery,Singaporean,3.1,2,Singapore,Alexandra Central Singapore,,1.2873279000000002,103.80522757246925
1444,e056,Keef the Beef (Rochester Common),Burgers,4.8,7,Singapore,Rochester Common Singapore,,,
1445,lzdf,Gebilaowang Bak Kut Teh (Geylang East Avenue 1),Bak Kut Teh,4.4,100,Singapore,Geylang East Avenue 1 Singapore,14.0,1.316634515348813,103.8852054023047
1446,i9ck,The Pho Place by LILY.S (KAP Mall),Vietnamese,3.5,11,Singapore,KAP Mall Singapore,,,
1447,mxzi,Ms Dessert Shop (Kadayanallur Street),Indian,4.7,11,Singapore,Kadayanallur Street Singapore,,1.2799135379870659,103.84501845435258
1448,w9to,G&B Bistro (Spago homemade Italian),Pasta,3.9,100,Singapore,Spago homemade Italian Singapore,,,
1449,k4a5,Prata Alley (321 Alexandra),Indian,4.5,100,Singapore,321 Alexandra Singapore,,1.2873279000000002,103.80522757246925
1450,m36n,Western Wild Wild (601 Macpherson),Western,5.0,5,Singapore,601 Macpherson Singapore,13.0,1.333701,103.8880883
1451,px87,Ferns N Petals  - Cake Shop (444 Tagore Industrial Ave) - Restaurant Delivery,Cakes,3.7,100,Singapore,444 Tagore Industrial Ave Singapore,,1.3846156,103.827453
1452,trdf,Bai Nian Niang Dou Fu (MacPherson Rd 601),Chinese,4.7,25,Singapore,MacPherson Rd 601 Singapore,13.0,1.3338724,103.8879254
1453,py6p,OBOY! (Neil Road),Sandwiches,4.7,7,Singapore,Neil Road Singapore,,1.2796982533699017,103.84253965738871
1454,x3wj,REBEL (Neil Road),Sandwiches,4.6,500,Singapore,Neil Road Singapore,,1.2796982533699017,103.84253965738871
1455,x4se,sofi cafe + keto & rooftop bar (Erskine Road),Pizza,4.1,100,Singapore,Erskine Road Singapore,,1.2806661269655388,103.84530481526393
1456,x4br,Pasta Brava (Erskine Road),Pasta,4.4,86,Singapore,Erskine Road Singapore,,1.2806661269655388,103.84530481526393
1457,c7ca,Hong Kong Street Chun Tat Kee (Serangoon),Chinese,4.3,500,Singapore,Serangoon Singapore,12.0,1.3497610500000001,103.87368414801405
1458,xvpl,Go2Eat (151 Serangoon North Ave 2),Western,4.5,100,Singapore,151 Serangoon North Ave 2 Singapore,12.0,1.3693772,103.8743758
1459,w55k,Li Wei Vegetarian (151 SERANGOON NORTH AVE 2),Vegetarian,4.4,100,Singapore,151 SERANGOON NORTH AVE 2 Singapore,12.0,1.3693772,103.8743758
1460,njhc,Danlao (Kadayanallur Street),Asian,4.6,100,Singapore,Kadayanallur Street Singapore,,1.2799135379870659,103.84501845435258
1461,iyya,ToMo Cafe (Neil Rd),Western,5.0,1,Singapore,Neil Rd Singapore,,1.2796982533699017,103.84253965738871
1462,pyrh,NangLen (Tanjong Pagar Road),Thai,4.7,9,Singapore,Tanjong Pagar Road Singapore,2.0,1.2763379040825258,103.84347047488141
1463,e5gy,BFF Fusion Fare 黄河麻辣美食 (KAP Mall),Asian,5.0,29,Singapore,KAP Mall Singapore,,,
1464,x7fa,KL Traditional Chilli Ban Mee (Geylang),Noodles,4.2,100,Singapore,Geylang Singapore,14.0,1.3181862,103.8870563
1465,x5je,Hua Kee Cooked Food (Geylang East Food Centre),Noodles,4.0,100,Singapore,Geylang East Food Centre Singapore,14.0,,
1466,k1zv,Boon Tat Street BBQ Seafood (The Shoppes At Marina Bay Sands),Chinese,2.9,15,Singapore,The Shoppes At Marina Bay Sands Singapore,1.0,1.2840209,103.85886829029963
1467,mgsf,Tai Feng Wei Fusion (Grantral Mall),Chinese,4.6,100,Singapore,Grantral Mall Singapore,,1.31429725,103.76513709084603
1468,whr6,Hong Style Fried Rice 四哥炒饭 (Circuit Road),Chinese,5.0,34,Singapore,Circuit Road Singapore,,1.32486595,103.888705
1469,z9qn,Haoju Ban Mian/Fish Soup/Pao Fan (Jalan Bukit Merah),Noodles,4.4,100,Singapore,Jalan Bukit Merah Singapore,,1.2778781386515055,103.83166574417798
1470,mftp,日日红麻辣香锅 Ririhong Malaxiangguo (Macpherson),Asian,3.8,3,Singapore,Macpherson Singapore,13.0,1.32620695,103.88950695393876
1471,x8hy,Camaca (King Albert Park),Cakes,4.1,25,Singapore,King Albert Park Singapore,,1.33570255,103.7835911750256
1472,ibp6,Somerset Delicacies (Maxwell Food Centre),Chinese,5.0,2,Singapore,Maxwell Food Centre Singapore,,,
1473,i67l,Jufu Fishball Noodle (132 Jalan Bukit Merah),Chinese,4.5,9,Singapore,132 Jalan Bukit Merah Singapore,,1.27869535,103.82836242524891
1474,x5ry,Hong Tang Ma La Tang 红糖麻辣烫 (Macpherson Road),Soups,4.2,61,Singapore,Macpherson Road Singapore,13.0,1.32983705,103.8742948
1475,sgfa,Kl Chicken Rice & Pork Leg Rice (Geylang Road),Chicken Rice,4.4,100,Singapore,Geylang Road Singapore,14.0,1.31241245,103.8779448
1476,d3ih,XIAO LA MEI MALA XIANG GUO 小辣妹麻辣香锅 (118 Aljunied Ave 2),Chinese,3.7,3,Singapore,118 Aljunied Ave 2 Singapore,,1.32002885,103.88763606016269
1477,c8vn,Dong Sheng Japanese Korean Cuisine (151 Serangoon North Ave 2),Seafood,4.3,1000,Singapore,151 Serangoon North Ave 2 Singapore,12.0,1.3693772,103.8743758
1478,y3eb,Xiao Ya Tou (Duxton Hill),Chinese,3.8,34,Singapore,Duxton Hill Singapore,,1.2794186656308204,103.84377092780451
1479,p7er,WEIZHUANG (Aljunied Ave 2),Soups,4.3,78,Singapore,Aljunied Ave 2 Singapore,,1.3203948755074686,103.88691959792565
1480,y8gg,Zhen Neng Zhu Ban Mian & Fish Soup 真能煮版面鱼汤 (115 Aljunied Ave 2),Seafood,4.2,100,Singapore,115 Aljunied Ave 2 Singapore,,1.3213192,103.88728127480013
1481,tnfj,Fatty Wanton Mee (Serangoon North Avenue 2),Chinese,4.0,31,Singapore,Serangoon North Avenue 2 Singapore,12.0,1.3690392335882742,103.87526315955621
1482,inf9,Carrotsticks Stanley (5 Stanley St),Healthy,4.9,8,Singapore,5 Stanley St Singapore,,1.2799843,103.84768635
1483,fzgm,Miznon (Stanley Street),Middle Eastern,4.8,100,Singapore,Stanley Street Singapore,,1.2801105000000002,103.84794575000001
1484,vqxy,Thachang SG (Telok Ayer),Thai,4.6,16,Singapore,Telok Ayer Singapore,,1.28233605,103.84829099740642
1485,wfby,Lao Huo Tang Chinese Mix Soup (Lau Pa Sat),Soups,4.5,100,Singapore,Lau Pa Sat Singapore,,1.28061665,103.85048020004061
1486,y726,Qiao Yuan Fish Soup Ban Mian (Bukit Merah),Chinese,4.5,70,Singapore,Bukit Merah Singapore,,1.2704395,103.82831840371266
1487,v4gi,Arkadas Cafe  (Fusionopolis View),Seafood,4.0,100,Singapore,Fusionopolis View Singapore,,1.2994819207209656,103.78890019721139
1488,rh80,Ding Wang Rojak & Min Jiang Kueh 鼎旺罗惹 & 麵煎粿 (Serangoon North Avenue 2),Singaporean,4.5,100,Singapore,Serangoon North Avenue 2 Singapore,12.0,1.3690392335882742,103.87526315955621
1489,qmf4,Thunder Spize (Lau Pa Sat),Japanese,3.9,15,Singapore,Lau Pa Sat Singapore,,1.28061665,103.85048020004061
1490,w6cz,Chuan Xiang Le Mala (Bukit Timah Plaza),Chinese,4.2,100,Singapore,Bukit Timah Plaza Singapore,10.0,1.3388228,103.7785937
1491,w4rh,Chong Qin Xiao Mian (Paya Lebar),Chinese,4.2,100,Singapore,Paya Lebar Singapore,14.0,1.3174795000000001,103.89235252467483
1492,w2xm,Kou Kou Xiang Clay Pot Rice (Geylang East Food Centre),Chinese,4.5,100,Singapore,Geylang East Food Centre Singapore,14.0,,
1493,pnsh,Tipo Strada (Keong Saik),Italian,4.6,12,Singapore,Keong Saik Singapore,,1.3120964,103.7971925
1494,z87i,Bu Zheng Zhong Hainanese Chicken Rice 不正宗海南鸡饭 (Bukit Merah Lane),Chicken,4.7,29,Singapore,Bukit Merah Lane Singapore,,1.286265,103.8051601
1495,o2jc,All 'Bout Chicken (Bukit Merah Lane),Fried Chicken,5.0,31,Singapore,Bukit Merah Lane Singapore,,1.286265,103.8051601
1496,npbd,Fort Canning Big Prawn Noodle (Aljunied),Malaysian,2.4,12,Singapore,Aljunied Singapore,,1.3164515,103.8829087
1497,x9fs,Sabio Duxton (5 Duxton Hill),Seafood,4.3,14,Singapore,5 Duxton Hill Singapore,,1.2793996,103.8429418449773
1498,vc5t,Creme & Cone (Raffles Quay),Dessert,5.0,9,Singapore,Raffles Quay Singapore,,1.28034925,103.850807
1499,x6hv,SRP Indian Muslim food (Clementi),Indian,4.3,1000,Singapore,Clementi Singapore,5.0,1.3140256,103.7624098
1500,w5zg,Sumac (Rifle Range),Indian,4.6,100,Singapore,Rifle Range Singapore,,1.3546292000000002,103.78884793404477
1501,z7py,Enchanted Cafe (24Hours) - Bukit Timah Plaza,Western,4.7,100,Singapore,24Hours Singapore,,,
1502,jkrb,Gigi Gastrobar & Bistro (4 Marina Boulevard),Italian,5.0,25,Singapore,4 Marina Boulevard Singapore,1.0,1.2810237,103.8523707
1503,d0ii,17 BBQ (118 Aljunied Avenue),Seafood,1.0,1,Singapore,118 Aljunied Avenue Singapore,,1.32002885,103.88763606016269
1504,dioq,Jin Ho Spinach Soup (Lau Pa Sat),Soups,4.6,59,Singapore,Lau Pa Sat Singapore,,1.28061665,103.85048020004061
1505,x1bf,Munmun Street Cafe (Bukit Timah),Singaporean,4.7,100,Singapore,Bukit Timah Singapore,10.0,1.3546901,103.7763724
1506,sdi3,17 house of noodle (Aljunied Ave 2),Singaporean,4.2,6,Singapore,Aljunied Ave 2 Singapore,,1.3203948755074686,103.88691959792565
1507,xoev,Al Habib Tandoori House (542B Serangoon),Indian,3.4,10,Singapore,542B Serangoon Singapore,12.0,1.37369355,103.87142417867372
1508,zym3,IEat Kitchen (Lau Pa Sat),Asian,4.1,89,Singapore,Lau Pa Sat Singapore,,1.28061665,103.85048020004061
1509,tpi8,MaFe Bento (Koptiam @ Lau Pa Sat),International,3.9,10,Singapore,Koptiam @ Lau Pa Sat Singapore,,,
1510,xahe,146 Famous Bukit Merah Ang Ku Kueh (Jalan Bukit Merah),Chinese,4.5,100,Singapore,Jalan Bukit Merah Singapore,,1.2778781386515055,103.83166574417798
1511,gaui,Le Petit Empire Designer Cakes (123 Bukit Merah) - Restaurant Delivery,Cakes,4.6,51,Singapore,123 Bukit Merah Singapore,,1.2862952,103.80363457290886
1512,obuo,Grill By Cut (Bukit Timah Plaza),Japanese,4.5,73,Singapore,Bukit Timah Plaza Singapore,10.0,1.3388228,103.7785937
1513,z3u8,Chef Goo (Bukit Merah Lane),Hokkien Mee,4.7,59,Singapore,Bukit Merah Lane Singapore,,1.286265,103.8051601
1514,gc82,Shuang Kitchen Ban Mian (Serangoon North Avenue 3),Noodles,4.6,100,Singapore,Serangoon North Avenue 3 Singapore,12.0,1.373522810262237,103.8708282574808
1515,x4o1,CHUAN WEI XIAO CHU 川味小厨 (546A Serangoon),Chinese,4.4,100,Singapore,546A Serangoon Singapore,12.0,1.3740510000000001,103.8701594010073
1516,h13c,Kko Kko Na Ra (Tanjong Pagar),Korean,4.3,56,Singapore,Tanjong Pagar Singapore,2.0,1.2764189,103.8429295
1517,qkdg,Legendary Fisherman (118 Aljunied Ave 2),Chinese,4.0,1,Singapore,118 Aljunied Ave 2 Singapore,,1.32002885,103.88763606016269
1518,y0kx,Love Fresh (Bukit Timah Plaza),Japanese,4.7,500,Singapore,Bukit Timah Plaza Singapore,10.0,1.3388228,103.7785937
1519,pz2o,Lao Chang Sha (18 Tai Seng St),Chinese,2.8,11,Singapore,18 Tai Seng St Singapore,,1.3359439,103.8889897
1520,ipyy,Hua Dee Hong Kong Roasted Delight (Lau Pa Sat),Asian,4.0,39,Singapore,Lau Pa Sat Singapore,,1.28061665,103.85048020004061
1521,v0dw,Dino Cake House & Cafe (Bukit Timah Plaza),Cakes,4.7,100,Singapore,Bukit Timah Plaza Singapore,10.0,1.3388228,103.7785937
1522,ocpd,MaFe Takibi (Koptiam @ Lau Pa Sat),Japanese,4.4,7,Singapore,Koptiam @ Lau Pa Sat Singapore,,,
1523,iru8,Quintet Five (Bukit Timah Plaza),Western,5.0,21,Singapore,Bukit Timah Plaza Singapore,10.0,1.3388228,103.7785937
1524,qm1e,190 Degrees Bakery (Bukit Merah),Asian,4.8,6,Singapore,Bukit Merah Singapore,,1.2704395,103.82831840371266
1525,j9mt,Maha Co. (Fusionopolis),Mexican,1.0,1,Singapore,Fusionopolis Singapore,,1.29923685,103.78789068320421
1526,v1p1,Yakiniku Don-Don 大阪焼肉 (Tanjong Pagar),Japanese,3.5,16,Singapore,Tanjong Pagar Singapore,2.0,1.2764189,103.8429295
1527,ekzw,Populus Coffee & Food Co (Neil Road),Western,5.0,11,Singapore,Neil Road Singapore,,1.2796982533699017,103.84253965738871
1528,xvam,The Gogijip Korean Charcoal BBQ (Tanjong Pagar),Korean,4.6,9,Singapore,Tanjong Pagar Singapore,2.0,1.2764189,103.8429295
1529,c0bs,Qiang Sheng Fried Rice (134 Geylang East Ave 1),Fried Rice,4.4,100,Singapore,134 Geylang East Ave 1 Singapore,14.0,1.3159569000000002,103.88583658003914
1530,h95r,Round Boy Roasters (Jalan Bukit Merah),Coffee,5.0,39,Singapore,Jalan Bukit Merah Singapore,,1.2778781386515055,103.83166574417798
1531,w4lx,Urban Roti (Lau Pa Sat),Indian,4.3,500,Singapore,Lau Pa Sat Singapore,,1.28061665,103.85048020004061
1532,h8jm,Cafe Wabi Sabi (Everton Park),Japanese,2.3,2,Singapore,Everton Park Singapore,,1.2771286000000002,103.8393679151902
1533,i7ov,Amigo's (Lorong Ah Soo),Western,4.7,100,Singapore,Lorong Ah Soo Singapore,,1.3520481,103.8845867
1534,x6se,Took Lae Dee (Tai Seng Street),Thai,4.6,100,Singapore,Tai Seng Street Singapore,,1.3347875999999999,103.8906227
1535,b9zj,Chengdu Bowl Flagship Store (Tanjong Pagar),Chinese,4.4,100,Singapore,Tanjong Pagar Singapore,2.0,1.2764189,103.8429295
1536,rmp6,Kungfu Mala Hotpot 功夫麻辣香锅 (Sakae Building),Chinese,3.7,28,Singapore,Sakae Building Singapore,,1.334919,103.88950789594247
1537,xyt4,Bag Me Up Bagel House (Everton Park),German,3.1,23,Singapore,Everton Park Singapore,,1.2771286000000002,103.8393679151902
1538,f0fm,Sweetest Moments (Bread Talk IHQ),Cakes,4.4,23,Singapore,Bread Talk IHQ Singapore,,,
1539,w1sw,Kajiken Ramen (Orchid Hotel),Japanese,4.7,500,Singapore,Orchid Hotel Singapore,,1.27688705,103.84388435112325
1540,makp,Lap Banh Mi (108 Depot Heights),Vietnamese,3.9,62,Singapore,108 Depot Heights Singapore,,1.28095275,103.81113999905601
1541,kh09,Curry & Curry (Hougang Street),Rice Dishes,3.3,43,Singapore,Hougang Street Singapore,19.0,1.37776255,103.88245888987892
1542,cgyi,Delicatesse (102 Tanjong Pagar Rd) - Islandwide Delivery,Bakery,4.9,9,Singapore,102 Tanjong Pagar Rd Singapore,2.0,1.27812825,103.84356596218254
1543,x1ml,Ya-Mahyuddin Al-Jailani Restaurant (Kampong Bahru),Indian,4.4,1000,Singapore,Kampong Bahru Singapore,,1.4175875,103.96954807407633
1544,n1nm,BLUEMIST (Tanjong Pagar Plaza),Western,4.3,41,Singapore,Tanjong Pagar Plaza Singapore,2.0,1.27574725,103.84241897381364
1545,zod9,Mad Roaster (Depot Road),Bakery,4.9,11,Singapore,Depot Road Singapore,,1.2814249199572212,103.80275211685421
1546,y6im,L32 handmade noodles (Geylang),Noodles,4.5,1000,Singapore,Geylang Singapore,14.0,1.3181862,103.8870563
1547,y4ou,Rice House Vegetarian (Geylang East Avenue),Vegetarian,4.3,500,Singapore,Geylang East Avenue Singapore,14.0,1.3174105,103.8858725
1548,i3eb,Sukhothai Thai Boat Noodle (Orchid Hotel),Thai,4.6,100,Singapore,Orchid Hotel Singapore,,1.27688705,103.84388435112325
1549,s1uy,Anglo Indian Cafe & Bar (Shenton Way),Indian,4.2,100,Singapore,Shenton Way Singapore,,1.2786955,103.8493414
1550,y0cw,Paninoteca By D.O.C (Asia Square),Italian,4.3,62,Singapore,Asia Square Singapore,,1.2785009999999999,103.85098016329769
1551,wlon,No. 17 Tea (Bukit Timah Shell),Bubble Tea,4.7,100,Singapore,Bukit Timah Shell Singapore,10.0,1.3113423,103.84312989566722
1552,kkyn,ZAC'S BRIYANI (INDIAN FOOD PRATA THOSAI CURRY HOUSE),Indian,4.2,100,Singapore,INDIAN FOOD PRATA THOSAI CURRY HOUSE Singapore,,,
1553,w7ke,Ha-Jun Korean (One North),Korean,4.5,100,Singapore,One North Singapore,,1.2995031,103.78729741855898
1554,x5jg,Kapitan (Maxwell Chambers),Chinese,4.2,76,Singapore,Maxwell Chambers Singapore,,1.2773506499999998,103.84634526572765
1555,v0db,The Providore (Downtown Gallery),Western,4.7,62,Singapore,Downtown Gallery Singapore,,1.2770527,103.84845776927241
1556,p9xl,Feng Tian Xiao Chu 奉天小厨 (Geylang Road),Chinese,3.8,100,Singapore,Geylang Road Singapore,14.0,1.31241245,103.8779448
1557,kwa7,3 Meals A Day 一日三餐 (Block 121 HDB Hougang),Chinese,4.6,100,Singapore,Block 121 HDB Hougang Singapore,19.0,,
1558,w3p7,Nana Banana (North Amenity Centre) - Islandwide Delivery,Indian,2.0,4,Singapore,North Amenity Centre Singapore,,,
1559,x1tc,Jalan Tua Kong Ya Lim Mee Pok (Telok Blangah),Noodles,4.5,1000,Singapore,Telok Blangah Singapore,4.0,1.27102005,103.80969476655733
1560,cgmu,Golden Scissors Curry Rice  - Old Airport Road Hawker Centre (51 Old Airport Rd),Chinese,4.6,16,Singapore,51 Old Airport Rd Singapore,,1.3086377,103.8863201
1561,sdju,3 Meals A Day 一日三餐 Ban Mian & Fish Soup (121 Hougang Avenue 1),Noodles,3.9,100,Singapore,121 Hougang Avenue 1 Singapore,19.0,1.35395285,103.88693006580068
1562,s0zy,8 Degrees (Lowland Road),Chinese,4.6,1000,Singapore,Lowland Road Singapore,,1.361042189481643,103.88316827423344
1563,n0hh,Osteria (Asia Square Tower 2),Pizza,4.7,51,Singapore,Asia Square Tower 2 Singapore,,1.2781208,103.85080585135529
1564,x0md,Wok Palace (Fusionopolis Way),Singaporean,4.5,40,Singapore,Fusionopolis Way Singapore,,1.29901345,103.78841955
1565,ufpn,Winners Fried Chicken (Telok Blangah),Fried Chicken,4.3,500,Singapore,Telok Blangah Singapore,4.0,1.27102005,103.80969476655733
1566,h168,ZAINAP RESTAURANT PTE LTD (Bukit Merah),Nasi Lemak,4.0,100,Singapore,Bukit Merah Singapore,,1.2704395,103.82831840371266
1567,x3ft,Teng Sheng Korean Cuisine (Serangoon North Ave),Korean,4.2,100,Singapore,Serangoon North Ave Singapore,12.0,1.3703489000000002,103.8747510760485
1568,l7sy,Western Barbeque (Old Airport Road),Chicken,4.4,100,Singapore,Old Airport Road Singapore,,1.3065084197086658,103.88333991077945
1569,mcwv,OSA Kaki Fuyong (144 Upper Bukit Timah),Japanese,4.9,10,Singapore,144 Upper Bukit Timah Singapore,10.0,1.342359,103.77643352307672
1570,u0by,Go Pasta (Bukit Timah Market & Food Centre),Pasta,4.7,100,Singapore,Bukit Timah Market & Food Centre Singapore,10.0,,
1571,qpwu,TIAN TIAN LE HAINANESE CHICKEN & CURRY RICE (144 Upper Bukit Timah),Chicken,4.3,11,Singapore,144 Upper Bukit Timah Singapore,10.0,1.342359,103.77643352307672
1572,t0x5,Sarawak Noodle (Telok Blangah),Noodles,2.9,35,Singapore,Telok Blangah Singapore,4.0,1.27102005,103.80969476655733
1573,aoxl,Makan Vegan 斋这里 (Geylang),Vegetarian,4.9,40,Singapore,Geylang Singapore,14.0,1.3181862,103.8870563
1574,azv9,Sheng xin fish head steamboat (Telok Blangah Cres),Seafood,4.8,16,Singapore,Telok Blangah Cres Singapore,4.0,1.2774161,103.81906217374383
1575,x3zd,3 Hainan Chicken Rice (Bukit Timah Market Food Centre),Grill,4.5,55,Singapore,Bukit Timah Market Food Centre Singapore,10.0,,
1576,s8xz,T Bob'S Corner (Tyrwhitt Road),American,4.5,500,Singapore,Tyrwhitt Road Singapore,,1.3123552,103.8609686
1577,w6fl,Aburi-EN (Tanjong Pagar Centre),Japanese,4.6,100,Singapore,Tanjong Pagar Centre Singapore,2.0,1.28655385,103.84462305428852
1578,ffz0,Jia Yuen Creamy Salted Egg Rice (Maxwell Road),Chinese,4.1,17,Singapore,Maxwell Road Singapore,,1.2800266321780274,103.84441256624257
1579,w4wd,RANDY INDULGENCE ACAI BAR (Guoco Tower),Acai Bowl,4.7,500,Singapore,Guoco Tower Singapore,,1.2770467,103.84547262636721
1580,nf4h,Pho Me Vietnamese Beef Noodles (Old Airport Rd),Asian,5.0,1,Singapore,Old Airport Rd Singapore,,1.3065084197086658,103.88333991077945
1581,w7cx,Zhou Ji Mala Xiang Guo 周记麻辣香锅 (Telok Blangah),Mala Xiang Guo,3.4,1000,Singapore,Telok Blangah Singapore,4.0,1.27102005,103.80969476655733
1582,w9zt,SBCD Korean Tofu House (Tanjong Pagar Centre),Korean,4.1,100,Singapore,Tanjong Pagar Centre Singapore,2.0,1.28655385,103.84462305428852
1583,zt3c,Tai Seng Herbal Soup  - Old Airport Road Hawker Centre (51 old Airport Rd),Chicken,2.9,18,Singapore,51 old Airport Rd Singapore,,1.3086377,103.8863201
1584,muqp,AH LOCK & CO (Wallich Street),Rice Dishes,4.5,100,Singapore,Wallich Street Singapore,,1.2768949658051614,103.84461900351118
1585,ltvu,Original Simon Road Hokkien Mee (Telok Blangah Crescent Market & Food Centre),Chinese,5.0,1,Singapore,Telok Blangah Crescent Market & Food Centre Singapore,4.0,1.2773843999999999,103.81868154496217
1586,nyzy,L'Arte Pizza & Focaccia (Guoco Tower),Pizza,4.8,63,Singapore,Guoco Tower Singapore,,1.2770467,103.84547262636721
1587,y7eu,Ye Tang Chendol (Beauty World Centre),Dessert,4.5,18,Singapore,Beauty World Centre Singapore,,1.342359,103.77643352307672
1588,m33u,Island Bistro (Telok Blangah),Asian,4.1,24,Singapore,Telok Blangah Singapore,4.0,1.27102005,103.80969476655733
1589,unmk,Munchi Pancakes Signatures! (Old Airport Rd),Dessert,4.9,19,Singapore,Old Airport Rd Singapore,,1.3065084197086658,103.88333991077945
1590,db6d,Yogiyo Korean (Beauty World Centre) - Islandwide Delivery,Korean,3.8,34,Singapore,Beauty World Centre Singapore,,1.342359,103.77643352307672
1591,p3ex,133 Penang Authentic (Bukit Timah Market & Food Centre),Noodles,4.8,100,Singapore,Bukit Timah Market & Food Centre Singapore,10.0,,
1592,ci2u,Steamed Healthy Stewed Soup (Bukit Timah Market & Food Centre),Soups,4.5,60,Singapore,Bukit Timah Market & Food Centre Singapore,10.0,,
1593,dpb8,Mom's Food (Beauty World Centre),Korean,4.0,25,Singapore,Beauty World Centre Singapore,,1.342359,103.77643352307672
1594,fb47,Nanyang Story (Upper Bukit Timah),Curry,4.9,8,Singapore,Upper Bukit Timah Singapore,10.0,1.3466479,103.7719139
1595,fp10,Bakes N Bites (Old Airport Road Food Centre),Cakes,4.1,7,Singapore,Old Airport Road Food Centre Singapore,,1.3082727,103.8858564
1596,y4ue,May's Kafe (Beauty World Centre),Singaporean,4.6,500,Singapore,Beauty World Centre Singapore,,1.342359,103.77643352307672
1597,xlct,Satefactory (Beauty World Centre),Chicken Wings,4.5,98,Singapore,Beauty World Centre Singapore,,1.342359,103.77643352307672
1598,oq2y,Sin Xiang Kee Pig's Organ Soup/Porridge/Braised (144 Upper Bukit Timah),Singaporean,2.7,3,Singapore,144 Upper Bukit Timah Singapore,10.0,1.342359,103.77643352307672
