,StoreId,CompleteStoreName,FoodType,AverageRating,Reviewers,City,Location,District,Latitude,Longitude
2803,y3aa,Man Zhu Huo Guo Dongbei Sichuan Cuisine 满族火锅东北菜川菜  (Jurong East),Chinese,4.7,500,Singapore,Jurong East Singapore,22.0,1.333108,103.7422939
2804,c1xl,Bakerland Western Delight (Tampines Central Community Complex),Grill,4.7,100,Singapore,Tampines Central Community Complex Singapore,18.0,,
2805,i9td,Kwang Kee Teochew Fish Porridge (One Punggol),Porridge,4.3,36,Singapore,One Punggol Singapore,19.0,1.4087988,103.90519040190867
2806,wqnz,Mexicana (820 Tampines Street 81),Mexican,4.8,100,Singapore,820 Tampines Street 81 Singapore,18.0,1.34798355,103.93617514902535
2807,kutq,Hong Sheng Fish Soup (347 Jurong East Avenue 1),Seafood,4.6,63,Singapore,347 Jurong East Avenue 1 Singapore,22.0,1.3452453,103.73153951041581
2808,kmpu,All In Fish Noodle (SAFRA @ Choa Chu Kang),Seafood,5.0,1,Singapore,SAFRA @ Choa Chu Kang Singapore,,1.38848065,103.74704800763365
2809,mbdu,Happy Pot Express Hotpot & BBQ (One Punggol Hawker Centre),Chinese,3.9,50,Singapore,One Punggol Hawker Centre Singapore,19.0,1.4081893,103.905058
2810,vzur,Long Cheng Bakery (293 Yishun North),Cakes,3.4,30,Singapore,293 Yishun North Singapore,27.0,1.4267291,103.8355699
2811,w8dr,Fat Po (Punggol),Singaporean,4.5,100,Singapore,Punggol Singapore,19.0,1.4054248,103.90179674458341
2812,f7w8,Dim Sum King 粤心聚 (Yishun Industrial),Asian,4.3,25,Singapore,Yishun Industrial Singapore,27.0,1.4414505,103.8339979
2813,v9sx,Whisk & Paddle (Punggol),Western,4.8,500,Singapore,Punggol Singapore,19.0,1.4054248,103.90179674458341
2814,fruw,SUN YOU Japanese Korean CUISINE (866A Tampines),Seafood,4.5,500,Singapore,866A Tampines Singapore,18.0,1.3553016,103.93429964097021
2815,x1kp,Ding Feng Seafood (You Le Tian),Chinese,4.3,1000,Singapore,You Le Tian Singapore,,,
2816,jnwm,Kjjong-9 Korean Cuisine (Choa Chu Kang),Korean,3.9,20,Singapore,Choa Chu Kang Singapore,,1.3892601,103.743728
2817,jxfu,Man Xiang Lor Mee (Yishun),Noodles,3.3,12,Singapore,Yishun Singapore,27.0,1.4293839,103.8350282
2818,y5z8,Miss Tea@Lot1 - Islandwide Delivery,Bubble Tea,5.0,5,Singapore,,,46.3144754,11.0480288
2819,ppmg,Putien Heng Hwa Cuisine (Food Junction - Lot One),Chinese,4.9,21,Singapore,Food Junction - Lot One Singapore,,,
2820,wu6p,ICG Chicken & Burger (Yishun),Fried Chicken,4.6,100,Singapore,Yishun Singapore,27.0,1.4293839,103.8350282
2821,v07c,Joo Siah Bak Koot Teh (Bak Kut Teh) (Jurong East) - Islandwide Delivery,Chinese,3.0,1,Singapore,Bak Kut Teh Singapore,,1.3745337,103.8866063
2822,k9yl,Haji Kadir (Tampines Polyview),Malaysian,4.5,2000,Singapore,Tampines Polyview Singapore,18.0,1.34679135,103.93633794984618
2823,eejh,MAXWELL CHICKEN PORRIDGE.RICE 金华鸡粥。鸡饭 (293 Yishun),Chinese,4.2,5,Singapore,293 Yishun Singapore,27.0,1.4365286,103.8375295
2824,cuze,Teochew Fish Soup 陈记鱼片汤 (Tampines Central Community Complex),Asian,4.3,61,Singapore,Tampines Central Community Complex Singapore,18.0,,
2825,x6ru,Habibie Seafood (Tampines Street),Seafood,4.4,2000,Singapore,Tampines Street Singapore,18.0,1.3494462,103.94410229255537
2826,y3zo,Hong Mao Qiao 711 麻辣香鍋 (Tampines St),Chinese,4.7,6,Singapore,Tampines St Singapore,18.0,1.3701049,103.9366505
2827,u6eo,KRAFT KITCHEN (Tampines Street),American,4.6,100,Singapore,Tampines Street Singapore,18.0,1.3494462,103.94410229255537
2828,hx8v,Hong Style Fried Rice 四哥炒饭 (North Point Bizhub),Fried Rice,4.7,48,Singapore,North Point Bizhub Singapore,,,
2829,z0r9,Pokeqpan - Teppanyaki Bento 鉄板焼き弁当 (One Punggol),Japanese,4.1,27,Singapore,One Punggol Singapore,19.0,1.4087988,103.90519040190867
2830,w1u7,123 Vietnamese Food Fish Soup (Bedok North Street 2),Vietnamese,4.0,5,Singapore,Bedok North Street 2 Singapore,16.0,1.327151,103.9377976
2831,x06z,San Shun Fishball Noodle (Jurong East),Noodles,4.4,500,Singapore,Jurong East Singapore,22.0,1.333108,103.7422939
2832,tq64,Hakka Leipopo (One Punggol),Chinese,4.3,6,Singapore,One Punggol Singapore,19.0,1.4087988,103.90519040190867
2833,d4ky,1990 Kopi Box & Bakery (Tampines),Bakery,4.8,100,Singapore,Tampines Singapore,18.0,1.3546528,103.9435712
2834,wlh9,Wongs Family Western (Tampines),Chicken Wings,4.5,22,Singapore,Tampines Singapore,18.0,1.3546528,103.9435712
2835,dd87,Sultan Indian Muslim Food (Tampines Street 72),Indian,4.4,60,Singapore,Tampines Street 72 Singapore,18.0,1.3591255,103.934662
2836,e5hw,New Hong Kong Roast (Punggol),Chinese,4.4,500,Singapore,Punggol Singapore,19.0,1.4054248,103.90179674458341
2837,g9lv,Changi Village Satay (Smart City Kitchens Tampines Food Co),Satay,4.8,100,Singapore,Smart City Kitchens Tampines Food Co Singapore,18.0,,
2838,h5ul,Xiao Bao Pig Trotter Rice (Woodlands Drive 16),Chinese,5.0,21,Singapore,Woodlands Drive 16 Singapore,25.0,1.43074305,103.79497345
2839,a5zz,Coffee & Chirashi (Sunshine Place),Rice Dishes,4.6,100,Singapore,Sunshine Place Singapore,,1.37779095,103.73892107634819
2840,x1vk,Amoy Ban Mian (One Punggol),Ban Mian,4.4,100,Singapore,One Punggol Singapore,19.0,1.4087988,103.90519040190867
2841,iifq,Gagaya 尜尜鸭 (10 Tampines North Drive 4),Chinese,2.9,22,Singapore,10 Tampines North Drive 4 Singapore,18.0,1.36548895,103.9318097
2842,avxv,CCK 302 Ngoh Hiang Prawn Cracker (Choa Chu Kang Ave 4),Singaporean,4.5,100,Singapore,Choa Chu Kang Ave 4 Singapore,,1.3847855,103.74567715
2843,h9ki,Yuan Man Vegetarian (Kopi House 1990),Vegetarian,4.7,500,Singapore,Kopi House 1990 Singapore,,,
2844,o0n9,House Of Fried Rice & Noodles (Choa Chu Kang Avenue 4),Fried Rice,4.6,100,Singapore,Choa Chu Kang Avenue 4 Singapore,,1.3847855,103.74567715
2845,ytl0,Indulge Selera (Choa Chu Kang),Chicken,4.6,500,Singapore,Choa Chu Kang Singapore,,1.3892601,103.743728
2846,ux2k,Basheer Indian Kitchen (Tampines Food Co),Indian,4.5,83,Singapore,Tampines Food Co Singapore,18.0,,
2847,s98l,Udders Ice Cream (Tampines),Dessert,5.0,21,Singapore,Tampines Singapore,18.0,1.3546528,103.9435712
2848,x9ln,Yes Nasi Kukus (573 Woodlands),Rice Dishes,4.7,1000,Singapore,573 Woodlands Singapore,25.0,1.436897,103.786216
2849,bvfm,煲仔KING (123 Bedok North),Asian,4.6,29,Singapore,123 Bedok North Singapore,16.0,1.3291889499999998,103.93735578564602
2850,v5dh,Lian Huat Roasted Delight 聯發燒臘 (Silverspoon Coffeeshop),Chinese,4.6,1000,Singapore,Silverspoon Coffeeshop Singapore,,,
2851,w9us,Holy Cow Creamery (Yishun),Pancakes and Waffles,4.8,500,Singapore,Yishun Singapore,27.0,1.4293839,103.8350282
2852,sbjh,SA-TAY (East Coast Lagoon Food Village),Satay,4.3,100,Singapore,East Coast Lagoon Food Village Singapore,,1.30694945,103.93494293617641
2853,ll4g,Bao Bao Japanese Cuisine  (681 Gourmet Paradise by Koufu),Japanese,4.8,38,Singapore,681 Gourmet Paradise by Koufu Singapore,,,
2854,v1lf,Zion Cafeteria (Bayshore Park Condominium),Chinese,4.3,1000,Singapore,Bayshore Park Condominium Singapore,,,
2855,vqph,KakWik Teahouse (326 Jurong East Street ),Singaporean,5.0,2,Singapore,326 Jurong East Street  Singapore,22.0,1.34899915,103.72962959333717
2856,ikwl,Katba Cafe (54 Bayshore Rd),Indian,2.7,3,Singapore,54 Bayshore Rd Singapore,,1.3118109,103.93688454516726
2857,v1xy,Crystal Jade GO (Punggol),Chinese,4.6,4000,Singapore,Punggol Singapore,19.0,1.4054248,103.90179674458341
2858,w4up,Makisan (Punggol Oasis),Sushi,4.7,3000,Singapore,Punggol Oasis Singapore,19.0,1.39748415,103.90945429107151
2859,yqwu,Thai Mama's Kitchen (Koufu @ Oasis Terraces),Seafood,4.5,100,Singapore,Koufu @ Oasis Terraces Singapore,,,
2860,eby8,The Braised House (Bedok North Street),Asian,4.9,99,Singapore,Bedok North Street Singapore,16.0,1.3271035,103.9311572
2861,gh6y,802 Rojak 802 罗惹 (Tampines Avenue 4),Singaporean,4.9,49,Singapore,Tampines Avenue 4 Singapore,18.0,1.3516937,103.9398922
2862,vzki,Ling Jie Kampong Delights (Food Park),Rice Dishes,4.3,100,Singapore,Food Park Singapore,,1.3887698,103.7709551
2863,p554,KFC (Jurong East 2),Chicken,4.5,100,Singapore,Jurong East 2 Singapore,22.0,1.3370585,103.74612080198142
2864,d8mo,Domino's Pizza (Tampines Avenue 4),Pizza,3.9,500,Singapore,Tampines Avenue 4 Singapore,18.0,1.3516937,103.9398922
2865,uu9b,Chef Meng's Poached Rice (681 Gourmet Paradise by Koufu),Rice Dishes,4.9,100,Singapore,681 Gourmet Paradise by Koufu Singapore,,,
2866,l8oq,81 Seafood Zichar (787B Choa Chu Kang Dr),Chinese,4.4,100,Singapore,787B Choa Chu Kang Dr Singapore,,1.3954100500000002,103.74811263230364
2867,z3op,Yong Tao Foo (681 Gourmet Paradise by Koufu),Thai,4.5,100,Singapore,681 Gourmet Paradise by Koufu Singapore,,,
2868,pp9j,PINWEI MALA 品味麻辣 (89 Bedok North),Chinese,4.7,5,Singapore,89 Bedok North Singapore,16.0,1.3325225,103.93804960242903
2869,v4se,Three's A Crowd Cafe (Tampines Estate),Pancakes and Waffles,4.7,100,Singapore,Tampines Estate Singapore,18.0,1.3361353,103.9398996
2870,s881,Kim Hock Roasted Delights 金福烧腊 (Bedok North Street 4),Chinese,4.9,21,Singapore,Bedok North Street 4 Singapore,16.0,1.3312519,103.9399758
2871,ub9g,This Cafe @ 326 (Jurong East Street 31),Western,4.8,100,Singapore,Jurong East Street 31 Singapore,22.0,1.3459113,103.7304886
2872,a1du,Fusion Express (Tampines),Western,4.5,500,Singapore,Tampines Singapore,18.0,1.3546528,103.9435712
2873,jcio,Hawa Restaurant (Tampines),Chinese,4.6,1000,Singapore,Tampines Singapore,18.0,1.3546528,103.9435712
2874,v6tv,Zoul's Corner (Tampines Avenue 4),Indonesian,4.7,5000,Singapore,Tampines Avenue 4 Singapore,18.0,1.3516937,103.9398922
2875,y3mu,Ong Kee Pig Organ Soup Kway Chap (548 Koufu),Soups,4.4,100,Singapore,548 Koufu Singapore,,,
2876,lu2n,Family’s Western Food (Choa Chu Kang),Western,4.1,25,Singapore,Choa Chu Kang Singapore,,1.3892601,103.743728
2877,h6jc,Gao Ji Steamed Gourmet (681 Gourmet Paradise by Koufu),Chinese,4.0,100,Singapore,681 Gourmet Paradise by Koufu Singapore,,,
2878,tyhq,Indian Food By Zion Cafe (Bayshore Park),Chicken,5.0,12,Singapore,Bayshore Park Singapore,,1.31140845,103.93637987236568
2879,uyir,Milk & Honey Gelato (Bedok North Street),Cakes,2.9,30,Singapore,Bedok North Street Singapore,16.0,1.3271035,103.9311572
2880,f90o,Tend Bistro (Northshore Plaza),Japanese,4.6,6,Singapore,Northshore Plaza Singapore,,1.4167181,103.90213409943384
2881,q9st,HJ Bistro (Northshore),International,2.9,94,Singapore,Northshore Singapore,,1.4169747,103.90257156210942
2882,s16b,Fish Soup Ban Mian (Koufu @ Oasis Terraces),Seafood,4.5,100,Singapore,Koufu @ Oasis Terraces Singapore,,,
2883,u7dt,Selesa Enak Chicken Rice (Koufu Giant),Chicken Rice,4.8,100,Singapore,Koufu Giant Singapore,,,
2884,e80h,Chops & Sear ( 570A Woodlands),Seafood,4.3,100,Singapore, 570A Woodlands Singapore,25.0,1.436897,103.786216
2885,y9fw,Fried Noodles & Carrot Cake (Punggol),Malaysian,4.2,500,Singapore,Punggol Singapore,19.0,1.4054248,103.90179674458341
2886,x0xp,Ah Ma Bak Kut Teh (Woodlands),Chinese,4.6,500,Singapore,Woodlands Singapore,25.0,1.436897,103.786216
2887,hj80,Hai Kee Soy Sauce Chicken Rice (Punggol),Chicken Rice,4.5,500,Singapore,Punggol Singapore,19.0,1.4054248,103.90179674458341
2888,x3jh,Li Yuan Seafood (Primz Bizhub),Seafood,3.1,64,Singapore,Primz Bizhub Singapore,,1.4352846499999998,103.8042493958775
2889,het6,Fulee Mixed Vegetable Rice (Woodlands Avenue 1),Chinese,3.7,31,Singapore,Woodlands Avenue 1 Singapore,25.0,1.4273395,103.7952098
2890,v2cn,Jack's Place (Safra Punggol),Western,4.0,500,Singapore,Safra Punggol Singapore,19.0,1.41027065,103.90617280283718
2891,w0ju,You Xin Korean & Japanese友新韩日料理 (Woodlands Close),Asian,4.3,100,Singapore,Woodlands Close Singapore,25.0,1.4345387,103.8043208
2892,vlc7,219 SARAWAK KOLO MEE (671 Edgefield Plains),Chinese,4.5,100,Singapore,671 Edgefield Plains Singapore,,1.40564125,103.91202157819538
2893,xaxu,Mr. Egg Fried Rice (Yishun Stall 6),Fried Rice,4.6,100,Singapore,Yishun Stall 6 Singapore,27.0,1.428136,103.8336942
2894,ln5g,Thai Riffic (671 Edgefield Plains),Thai,3.9,20,Singapore,671 Edgefield Plains Singapore,,1.40564125,103.91202157819538
2895,uhrf,Rong Cheng Rou Gu Cha (Upper Changi Rd),Bak Kut Teh,4.6,100,Singapore,Upper Changi Rd Singapore,17.0,1.34190865,103.96131029336905
2896,hwey,639 Western Food (639 Punggol Drive),Western,4.5,100,Singapore,639 Punggol Drive Singapore,19.0,1.39948725,103.91605990010633
2897,l263,Charcoal Roasted Delights (Tampines),Rice Dishes,4.3,72,Singapore,Tampines Singapore,18.0,1.3546528,103.9435712
2898,r4db,Jing House Western (Koufu Giant),Pasta,4.3,100,Singapore,Koufu Giant Singapore,,,
2899,o2ad,Zheng Xiang Bak Kut Teh (Bedok East),Malaysian,4.2,4,Singapore,Bedok East Singapore,16.0,1.3164109499999999,103.9491055866304
2900,t8jh,Pig Organ Soup (Koufu Giant Building),Soups,4.1,57,Singapore,Koufu Giant Building Singapore,,,
2901,z406,Lao Liang Kway Chap 老良粿汁 (Punggol),Chinese,3.9,29,Singapore,Punggol Singapore,19.0,1.4054248,103.90179674458341
2902,k1in,Al Rsak Indian Food (Choa Chu Kang Avenue 4),Indian,4.3,100,Singapore,Choa Chu Kang Avenue 4 Singapore,,1.3847855,103.74567715
2903,wvk7,Anna's (Punggol Dr),International,4.6,76,Singapore,Punggol Dr Singapore,19.0,1.4073076,103.9055053
2904,gkkt,Khadijah Indian Muslim Food (Koufu Giant),Indian,4.4,65,Singapore,Koufu Giant Singapore,,,
2905,mfa6,Happy Thai Food (Giant Hypermart Tampines),Seafood,4.3,100,Singapore,Giant Hypermart Tampines Singapore,18.0,,
2906,zq2d,Bee-Live Beverage & Dessert (Yew Tee Point),Beverages,5.0,13,Singapore,Yew Tee Point Singapore,,1.3971484,103.7465502
2907,a6h1,Tasty Sarawak Kolo Mee (Yew Tee Point),Malaysian,4.4,14,Singapore,Yew Tee Point Singapore,,1.3971484,103.7465502
2908,w7t7,Chayo (Northshore Drive),Thai,4.9,20,Singapore,Northshore Drive Singapore,,1.4179119,103.9116314
2909,w0dl,Dim Sum Affair (Koufu Yew Tee),Singaporean,4.4,100,Singapore,Koufu Yew Tee Singapore,,1.3971484,103.7465502
2910,f28c,Fish Soup King (Hawker Centre @OTH),Chinese,2.9,2,Singapore,Hawker Centre @OTH Singapore,,,
2911,w3se,Ding Ji Fishball Noodle (Koufu Yew Tee),Noodles,4.6,100,Singapore,Koufu Yew Tee Singapore,,1.3971484,103.7465502
2912,aw6u,Renee's Classic (Yew Tee Point Koufu),Western,4.5,500,Singapore,Yew Tee Point Koufu Singapore,,1.3971484,103.7465502
2913,cfwh,Izumi Japanese Restaurant (New Upper Changi Road),Japanese,4.9,21,Singapore,New Upper Changi Road Singapore,17.0,1.324269055850696,103.93113889956948
2914,x3zj,Kow Loon (Upper Changi),Chinese,4.2,100,Singapore,Upper Changi Singapore,17.0,1.34190865,103.96131029336905
2915,wul8,Outback Hot Pot 再回首麻辣香锅 (New Upper Changi),Chinese,4.2,94,Singapore,New Upper Changi Singapore,17.0,1.324269055850696,103.93113889956948
2916,x7gp,Desserts (Our Tampines Hub),Noodles,4.3,100,Singapore,Our Tampines Hub Singapore,18.0,1.3530262,103.94067277047982
2917,xs96,Crust Bistro (74 Bayshore Rd) - Islandwide Delivery,Indian,3.3,5,Singapore,74 Bayshore Rd Singapore,,1.3111826500000001,103.93933100365706
2918,unni,The Only Burger - Muslim Owned (Tampines),Asian,4.9,9,Singapore,Tampines Singapore,18.0,1.3546528,103.9435712
2919,gyab,Qi Ji (Northshore Plaza),Nasi Lemak,4.6,500,Singapore,Northshore Plaza Singapore,,1.4167181,103.90213409943384
2920,s7iu,Take-Out Salad (Yew Tee Point),Salads,4.9,500,Singapore,Yew Tee Point Singapore,,1.3971484,103.7465502
2921,w9xg,Fruit Juice & Fruits (Koufu Yew Tee),Beverages,4.7,100,Singapore,Koufu Yew Tee Singapore,,1.3971484,103.7465502
2922,hzlr,Mizu Express (Northshore Drive),Japanese,3.4,37,Singapore,Northshore Drive Singapore,,1.4179119,103.9116314
2923,x6rz,Zijia Yong Tau Foo (MEGA@Woodlands),Chinese,4.0,100,Singapore,MEGA@Woodlands Singapore,25.0,1.43802595,103.80700129934152
2924,omks,Little Caesars Pizza (Northshore Plaza),Pizza,4.6,100,Singapore,Northshore Plaza Singapore,,1.4167181,103.90213409943384
2925,uv3w,Eastern Rice Dumpling 东园肉粽 (Choa Chu Kang),Chinese,1.0,1,Singapore,Choa Chu Kang Singapore,,1.3892601,103.743728
2926,jj05,Shi Ye Japanese Korean Cuisine ( 39 Woodlands Close),Japanese,2.4,7,Singapore, 39 Woodlands Close Singapore,25.0,1.4345387,103.8043208
2927,w3ou,Happiness Sunbo Roasted Delights (Koufu Yew Tee),Chicken,4.4,100,Singapore,Koufu Yew Tee Singapore,,1.3971484,103.7465502
2928,pbds,Fro~Yo! (Yew Tee Point) - Islandwide Delivery,Dessert,5.0,1,Singapore,Yew Tee Point Singapore,,1.3971484,103.7465502
2929,fmp3,Duck King (Koufu Yew Tee),Chinese,4.1,81,Singapore,Koufu Yew Tee Singapore,,1.3971484,103.7465502
2930,bu8y,Koo Kee Restaurant (21 Choa Chu Kang),Noodles,4.7,100,Singapore,21 Choa Chu Kang Singapore,,1.3854394,103.7447255
2931,kmio,Swee Heng 1989 Classic (Northshore Plaza),Bakery,4.8,31,Singapore,Northshore Plaza Singapore,,1.4167181,103.90213409943384
2932,f86u,Jue Shi Lorong Mee (495 Tampines Avenue 5),Noodles,4.4,50,Singapore,495 Tampines Avenue 5 Singapore,18.0,1.3497317,103.9417376
2933,z5do,Hao Zai Lai Japanese & Korean (Koufu Yew Tee),Japanese,4.6,100,Singapore,Koufu Yew Tee Singapore,,1.3971484,103.7465502
2934,zs2s,Fat Baby Rotisserie and Western Cuisine (Cantine by Kopitiam @ Northshore Plaza II),Western,4.5,14,Singapore,Cantine by Kopitiam @ Northshore Plaza II Singapore,,1.4181923,103.9010666
2935,v0rv,13 Miles (Sembawang),Chinese,4.7,3000,Singapore,Sembawang Singapore,27.0,1.4514207,103.8179186
2936,g1z6,Lepak One Corner by Yassin Kampung (Yishun Industrial Park),Asian,3.9,100,Singapore,Yishun Industrial Park Singapore,27.0,1.4414505,103.8339979
2937,uik6,Gastro Viet Thai (Kopitiam @ Northshore),Thai,2.0,31,Singapore,Kopitiam @ Northshore Singapore,,1.4181923,103.9010666
2938,ww3o,Jia Yan Seafood 家宴海鲜馆 (Jurong SuperBowl),Chinese,5.0,5,Singapore,Jurong SuperBowl Singapore,22.0,1.3258657,103.7246992
2939,pq6o,One Space Kitchen 壹间小厨 (Tampines),Chinese,4.2,34,Singapore,Tampines Singapore,18.0,1.3546528,103.9435712
2940,d3tc,Ah Chew Yong Tau Foo (Kopitiam @ Yew Tee Square),Yong Tau Foo,4.2,100,Singapore,Kopitiam @ Yew Tee Square Singapore,,,
2941,v5kp,7Th Heaven Ktv & Cafe (Tampines SAFRA),Pasta,3.9,100,Singapore,Tampines SAFRA Singapore,18.0,1.34477595,103.94205961614855
2942,fivo,Bakery Degree (New Upper Changi Road),Pancakes and Waffles,3.9,14,Singapore,New Upper Changi Road Singapore,17.0,1.324269055850696,103.93113889956948
2943,n1m1,Downstairs (Northshore Drive),Chinese,4.8,79,Singapore,Northshore Drive Singapore,,1.4179119,103.9116314
2944,tnvj,Kiev Cuisine & Mala Xiang Guo (Broadway Coffeeshop),Rice Dishes,4.0,28,Singapore,Broadway Coffeeshop Singapore,,1.3713479,103.8816021
2945,r8kt,Vs Cafe (Northshore Drive),Vietnamese,4.8,28,Singapore,Northshore Drive Singapore,,1.4179119,103.9116314
2946,kif5,xi de li (Tampines Hub),Chinese,4.2,51,Singapore,Tampines Hub Singapore,18.0,1.3530262,103.94067277047982
2947,j5j0,Zhen Neng Zhu Ban Mian & Fish Soup (Super Bowl),Soups,4.4,100,Singapore,Super Bowl Singapore,,,
2948,v5ka,Napolizz Pizza (Choa Chu Kang) - Restaurant Delivery,Pizza,4.5,500,Singapore,Choa Chu Kang Singapore,,1.3892601,103.743728
2949,dtzu,House of White Bee Hoon Signature (Our Tampines Hub) - Islandwide Delivery,Chinese,5.0,1,Singapore,Our Tampines Hub Singapore,18.0,1.3530262,103.94067277047982
2950,v3oe,Toko Burgers (Our Tampines Hub),Burgers,4.5,2000,Singapore,Our Tampines Hub Singapore,18.0,1.3530262,103.94067277047982
2951,vaip,LINA Fishball Noodle (Tampines North),Noodles,4.1,22,Singapore,Tampines North Singapore,18.0,1.3675672,103.9378199
2952,ap1m,Guru Curry Prata House Indian Restaurant (1001 Yishun),Asian,4.4,6,Singapore,1001 Yishun Singapore,27.0,1.428136,103.8336942
2953,x7qc,Ka Ka Japanese Curry House (Our Tampines Hub),Curry,4.6,100,Singapore,Our Tampines Hub Singapore,18.0,1.3530262,103.94067277047982
2954,kwg0,EAT BAR 来吧吃霸  (Jurong West),Chinese,3.9,100,Singapore,Jurong West Singapore,22.0,1.3434392,103.7058663
2955,o2gx,Pang Pang Wanton Noodle (Our Tampines Hub),Chinese,4.4,100,Singapore,Our Tampines Hub Singapore,18.0,1.3530262,103.94067277047982
2956,u7xg,Wanton Noodles (Yew Tee Square),Chinese,4.5,1000,Singapore,Yew Tee Square Singapore,,1.3982858,103.74700820164291
2957,uvz6,929 Desserts and Bites (SAFRA Tampines),Dessert,4.7,38,Singapore,SAFRA Tampines Singapore,18.0,1.34477595,103.94205961614855
2958,jn5m,Hong Le Korean & Japanese Cuisine (Northshore Plaza II),Korean,4.7,69,Singapore,Northshore Plaza II Singapore,,1.4179029,103.90128449195812
2959,y0hj,Shake Shake In A Tub (Our Tampines Hub),Snacks,4.6,500,Singapore,Our Tampines Hub Singapore,18.0,1.3530262,103.94067277047982
2960,r108,Kampong House Mini Wok (Superbowl),Chinese,4.9,100,Singapore,Superbowl Singapore,,1.3297931,103.8541959
2961,v10z,Chi You Lai Chicken Rice & Roasted Delights (Choa Chu Kang),Rice Dishes,3.8,23,Singapore,Choa Chu Kang Singapore,,1.3892601,103.743728
2962,j1fc,Indo Express (Kopitiam @ Northshore) - Islandwide Delivery,Indonesian,5.0,11,Singapore,Kopitiam @ Northshore Singapore,,1.4181923,103.9010666
2963,a5qo,The Salad Crunch (Tampines Hub),Salads,4.8,100,Singapore,Tampines Hub Singapore,18.0,1.3530262,103.94067277047982
2964,gd0a,Fat Baby Chilli Ban Mian (Cantine by Kopitiam @ Northshore Plaza II),Chicken,4.8,25,Singapore,Cantine by Kopitiam @ Northshore Plaza II Singapore,,1.4181923,103.9010666
2965,hzfc,Ah Er Soup 阿 2老火汤 (Superbowl) - Islandwide Delivery,Soups,4.7,50,Singapore,Superbowl Singapore,,1.3297931,103.8541959
2966,y9xa,Unicuz Mala Xiang Guo (Jurong Leisure Complex),Mala Xiang Guo,4.4,100,Singapore,Jurong Leisure Complex Singapore,22.0,,
2967,llub,Lau Pa Sat Tze Char (Northshore Plaza II),Chinese,4.0,70,Singapore,Northshore Plaza II Singapore,,1.4179029,103.90128449195812
2968,lriu,Al Taj Indian Muslim Food (673B Choa Chu Kang),Indian,4.7,100,Singapore,673B Choa Chu Kang Singapore,,1.3892601,103.743728
2969,g5pq,Guzman Y Gomez (Tampines Hub),Mexican,4.5,2000,Singapore,Tampines Hub Singapore,18.0,1.3530262,103.94067277047982
2970,j3iq,My Little Coconut (Our Tampines Hub),Beverages,3.7,26,Singapore,Our Tampines Hub Singapore,18.0,1.3530262,103.94067277047982
2971,pfbb,Sembawang Traditional Claypot Rice (Sembawang) - Islandwide Delivery,Chinese,5.0,1,Singapore,Sembawang Singapore,27.0,1.4514207,103.8179186
2972,jwcj,Tea Hunters (Sembawang),Bubble Tea,3.2,40,Singapore,Sembawang Singapore,27.0,1.4514207,103.8179186
2973,wv5s,Nosh Bistro (Sembawang),International,4.0,1,Singapore,Sembawang Singapore,27.0,1.4514207,103.8179186
2974,l5xn,Lai Delicious (Sembawang),Beverages,4.6,7,Singapore,Sembawang Singapore,27.0,1.4514207,103.8179186
2975,vpta,KC’s Momo (Punggol),Indian,4.5,81,Singapore,Punggol Singapore,19.0,1.4054248,103.90179674458341
2976,we3l,Saap Saap Thai (Tampines) - Islandwide Delivery,Thai,4.7,100,Singapore,Tampines Singapore,18.0,1.3546528,103.9435712
2977,x3xa,Leaf Corner Vegetarian (Sembawang),Vegetarian,4.7,2000,Singapore,Sembawang Singapore,27.0,1.4514207,103.8179186
2978,te2f,Gado & Grill (Our Tampines Hub) - Islandwide Delivery,Indonesian,4.8,73,Singapore,Our Tampines Hub Singapore,18.0,1.3530262,103.94067277047982
2979,e2f1,White Restaurant (Jalan Tampang),Singaporean,4.6,100,Singapore,Jalan Tampang Singapore,,1.4421208,103.8238251
2980,tjz2,Curry and spicez (Our Tampines Hub) - Islandwide Delivery,Indian,2.9,2,Singapore,Our Tampines Hub Singapore,18.0,1.3530262,103.94067277047982
2981,ky83,Fruce (Tampines Hub),Beverages,4.8,100,Singapore,Tampines Hub Singapore,18.0,1.3530262,103.94067277047982
2982,h5yz,Mi Xiang Mix Rice 米香拌饭 (Jalan Tampang),Japanese,4.2,100,Singapore,Jalan Tampang Singapore,,1.4421208,103.8238251
2983,vfo6,Ba Jie Pig Trotter Rice 八戒猪脚饭 (Jurong West),Asian,5.0,1,Singapore,Jurong West Singapore,22.0,1.3434392,103.7058663
2984,y4jc,Ma Mum To-Go (Our Tampines Hub),Singaporean,4.6,500,Singapore,Our Tampines Hub Singapore,18.0,1.3530262,103.94067277047982
2985,x0wr,Hei Sushi (Sembawang) - Restaurant Delivery,Japanese,4.4,500,Singapore,Sembawang Singapore,27.0,1.4514207,103.8179186
2986,v7se,Just Acia (Sembawang),Fried Chicken,4.6,1000,Singapore,Sembawang Singapore,27.0,1.4514207,103.8179186
2987,swa0,Pizza Nation (Tampines) - Islandwide Delivery,Pizza,4.0,1,Singapore,Tampines Singapore,18.0,1.3546528,103.9435712
2988,x1ib,The Chef's Place (Choa Chu Kang),Chicken,4.5,1000,Singapore,Choa Chu Kang Singapore,,1.3892601,103.743728
2989,j4fv,Kns Thai Muslim Restaurant (Jurong West Avenue 1),Indian,4.2,500,Singapore,Jurong West Avenue 1 Singapore,22.0,1.3498657,103.7271268
2990,z6bz,Kumamoto Specialities (Jalan Tampang),Japanese,4.7,51,Singapore,Jalan Tampang Singapore,,1.4421208,103.8238251
2991,owe6,H.Y Bento En (Sembawang),Japanese,4.4,36,Singapore,Sembawang Singapore,27.0,1.4514207,103.8179186
2992,hv0i,Bukit Panjang Dessert Stall (Victory 8),Coffee,4.6,100,Singapore,Victory 8 Singapore,,1.4418128000000001,103.82373727782667
2993,aykm,Pang Zi Durian And Ice Cream House (Jurong West Street 41),Ice Cream,4.8,64,Singapore,Jurong West Street 41 Singapore,22.0,1.349827,103.7257694
2994,v6hi,Mohamed Irshad (693 Woodlands Ave 6),Singaporean,4.7,1000,Singapore,693 Woodlands Ave 6 Singapore,25.0,1.4380972,103.80378149144214
2995,x9ub,Baker's Brew Studio (Sembawang),Cakes,4.6,500,Singapore,Sembawang Singapore,27.0,1.4514207,103.8179186
2996,x9fq,Abang Recipes (Sembawang Shopping Centre),Singaporean,4.6,1000,Singapore,Sembawang Shopping Centre Singapore,27.0,1.44186825,103.82493123784184
2997,x1dv,Lao Er Bak Kut Teh 老2肉骨茶 (Yuan Ching),Rice Dishes,4.4,100,Singapore,Yuan Ching Singapore,,1.3253899,103.7282017
2998,y0tg,Tang Tea House (Jurong West),Singaporean,4.7,2000,Singapore,Jurong West Singapore,22.0,1.3434392,103.7058663
2999,skol,Joyful Chicken Rice (Tampines),Asian,4.3,22,Singapore,Tampines Singapore,18.0,1.3546528,103.9435712
3000,e6pn,Captain Kim Korean BBQ (Tampines Junction),Korean,4.3,100,Singapore,Tampines Junction Singapore,18.0,1.3525284,103.9418957
3001,j5k0,San Wei Claypot Rice Noodle 叁味小锅米线 (28 Gambas Cres),Chinese,3.4,11,Singapore,28 Gambas Cres Singapore,,1.4433187620766141,103.81443614576716
3002,psxl,Old Changsha Stinky Tofu 老长沙臭豆腐 (28 Gambas Cres),Chinese,2.1,10,Singapore,28 Gambas Cres Singapore,,1.4433187620766141,103.81443614576716
