,StoreId,CompleteStoreName,FoodType,AverageRating,Reviewers,City,Location,District,Latitude,Longitude
0,sos6,Teochew Hai Gang Fish Soup 潮州海港鱼汤 (Toa Payoh),Asian,4.0,1,Singapore,Toa Payoh Singapore,12.0,1.3353906,103.8497414
1,cc4y,Homtang Thai (Balestier Road),Thai,4.9,9,Singapore,Balestier Road Singapore,12.0,1.3181005488832067,103.85551719932096
2,sh3w,Xin Mei Xiang Zheng Zong Lor Mee 新美香正宗卤面 (Balestier),Noodles,4.4,100,Singapore,Balestier Singapore,12.0,1.326226,103.8473149
3,ih76,Soon Huat BBQ Seafood (Lorong 4 Toa Payoh),Seafood,4.3,100,Singapore,Lorong 4 Toa Payoh Singapore,12.0,1.339295192615857,103.85071816418802
4,yrj9,BaliNice Mala Hotpot 八里香麻辣香锅 (Lorong 1 Toa Payoh),Snacks,4.2,89,Singapore,Lorong 1 Toa Payoh Singapore,12.0,1.3364166394955617,103.84349895384877
5,s1jq,Shi Kou Seafood (Balestier Road),Chinese,4.3,500,Singapore,Balestier Road Singapore,12.0,1.3181005488832067,103.85551719932096
6,c8dk,Tea Apothecary (Toa Payoh View),Bubble Tea,4.7,100,Singapore,Toa Payoh View Singapore,12.0,1.3388134,103.84520184917032
7,x7gm,Xiao Lao Ban Xiang Guo 小老板香锅 (Balestier Road),Curry,4.1,100,Singapore,Balestier Road Singapore,12.0,1.3181005488832067,103.85551719932096
8,x2ku,Thai Tai 泰太 (Former Noodle ThaiThai),Thai,4.7,3000,Singapore,Former Noodle ThaiThai Singapore,,,
9,h6sj,Fire Rice (125 Toa Payoh Lorong),Fried Rice,4.9,13,Singapore,125 Toa Payoh Lorong Singapore,12.0,1.3375453,103.84570661006799
10,x6te,Lechon Republic (Novena Regency),Filipino,4.7,1000,Singapore,Novena Regency Singapore,11.0,1.3210796,103.84162625601599
11,ogb9,Naowarat Thai Cuisine (Monville Mansion),Thai,4.1,20,Singapore,Monville Mansion Singapore,,,
12,vclh,Niche Savoureuse (Lorong 1 Toa Payoh),Western,4.0,1,Singapore,Lorong 1 Toa Payoh Singapore,12.0,1.3364166394955617,103.84349895384877
13,x8aj,Full Feast Seafood (Johnson Eatery),Seafood,4.5,100,Singapore,Johnson Eatery Singapore,,1.3381097,103.8458437
14,q1pd,Lam's Noodle & Salt Baked Chicken  (Koufu 500 TPY),Noodles,4.6,500,Singapore,Koufu 500 TPY Singapore,,,
15,yvv4,Western Boy Classic (Koufu @ HDB Hub),Pasta,4.5,100,Singapore,Koufu @ HDB Hub Singapore,,,
16,x9qd,Eday Western (Lorong 1 Toa Payoh),Western,4.5,500,Singapore,Lorong 1 Toa Payoh Singapore,12.0,1.3364166394955617,103.84349895384877
17,ivi3,Meet Noodles (Toa Payoh),Chinese,4.8,29,Singapore,Toa Payoh Singapore,12.0,1.3353906,103.8497414
18,bj6v,Zhenwei ZiChar (126 Lor 1 Toa Payoh),Asian,4.3,43,Singapore,126 Lor 1 Toa Payoh Singapore,12.0,,
19,sue4,Haituhotpot (520 Balestier Road),Chinese,4.0,1,Singapore,520 Balestier Road Singapore,12.0,1.3268791,103.84591460824433
20,phu9,一人饭 1Pax Bowl (558 Balestier),Chinese,3.8,21,Singapore,558 Balestier Singapore,12.0,1.3267899,103.84490831785921
21,ij4n,4Fingers Crispy Chicken (Balestier),Fried Chicken,4.6,1000,Singapore,Balestier Singapore,12.0,1.326226,103.8473149
22,dvvf,Pontian Wanton Noodle X Nanyang Noodle House (Lorong 1 Toa Payoh),Chinese,4.6,100,Singapore,Lorong 1 Toa Payoh Singapore,12.0,1.3364166394955617,103.84349895384877
23,k95g,Sing Swee Kee Chicken Rice (Toa Payoh),Chicken,4.2,100,Singapore,Toa Payoh Singapore,12.0,1.3353906,103.8497414
24,tu6w,Whampoa Keng Fish Head Steamboat Restaurant (Balestier Road) - Islandwide Delivery,Chinese,4.9,5,Singapore,Balestier Road Singapore,12.0,1.3181005488832067,103.85551719932096
25,x4rx,Hua Zai Frog Porridge & BBQ Seafood (Toa Payoh),Porridge,4.4,1000,Singapore,Toa Payoh Singapore,12.0,1.3353906,103.8497414
26,a3i1,Balestier Seafood 马来西亚风味 (Balestier Road),Malaysian,4.5,100,Singapore,Balestier Road Singapore,12.0,1.3181005488832067,103.85551719932096
27,vhj8,ARIFF'S CURRY - INDIAN FOOD PRATA CURRY HOUSE (381 Toa Payoh),Indian,4.1,67,Singapore,381 Toa Payoh Singapore,12.0,1.3402949999999998,103.8451214325592
28,zjhr,The Ritual (Bukit Timah Road) - Islandwide Delivery,Beverages,5.0,4,Singapore,Bukit Timah Road Singapore,10.0,1.3322848500000002,103.79346285
29,rka8,NIU HONGHONG RESTAURANT  牛哄哄食堂 (Toa Payoh),Chinese,5.0,3,Singapore,Toa Payoh Singapore,12.0,1.3353906,103.8497414
30,qnii,Nana's Açaí (Toa Payoh Lorong 2),Dessert,4.9,100,Singapore,Toa Payoh Lorong 2 Singapore,12.0,1.3325257499999998,103.84738647593639
31,x5xw,Mr YouTiao Café & Meals (Square 2),Porridge,4.3,500,Singapore,Square 2 Singapore,,1.3206362,103.84418667335355
32,v6zw,Viet Thai Cuisine (Toa Payoh),Asian,4.2,500,Singapore,Toa Payoh Singapore,12.0,1.3353906,103.8497414
33,y3ab,Ichiban Bento (Toa Payoh Hub),Japanese,4.7,500,Singapore,Toa Payoh Hub Singapore,12.0,1.3427461,103.85248926599107
34,q4fg,Indulge Teppanyaki & Grill House (31 Ah Hood Rd),Japanese,4.6,1000,Singapore,31 Ah Hood Rd Singapore,,1.32888615,103.84898475745942
35,v2qy,Celine's Gelato (Novena Regency),Dessert,4.5,17,Singapore,Novena Regency Singapore,11.0,1.3210796,103.84162625601599
36,ubqd,Mangiano By CC (Novena Regency),Italian,3.7,12,Singapore,Novena Regency Singapore,11.0,1.3210796,103.84162625601599
37,am3a,Al Hadheerah Express (Hdb Hub),Indian,4.6,74,Singapore,Hdb Hub Singapore,,1.3317686,103.848557
38,cy86,Rosdee Thai (Toa Payoh),Thai,4.3,25,Singapore,Toa Payoh Singapore,12.0,1.3353906,103.8497414
39,y1sg,Hua Fong Kee Roasted Duck (116 Toa Payoh Lorong 2),Singaporean,4.6,100,Singapore,116 Toa Payoh Lorong 2 Singapore,12.0,1.33676695,103.84650539098374
40,y7dr,Kai Le Korean Cuisine (Toa Payoh),Japanese,4.7,55,Singapore,Toa Payoh Singapore,12.0,1.3353906,103.8497414
41,okb0,Hong Fan Tian Mala Xiang Guo (Toa Payoh Lorong 6) - Islandwide Delivery,Chinese,5.0,2,Singapore,Toa Payoh Lorong 6 Singapore,12.0,1.33839955,103.85157186044839
42,uhtw,OTOU-SAN HOKKAIDO DONBURI (Zhongshan Mall),Japanese,4.5,100,Singapore,Zhongshan Mall Singapore,,1.3272079,103.8464351
43,yinw,WIKEDO WESTERN FOOD (KOUFU HDB HUB),Western,4.4,16,Singapore,KOUFU HDB HUB Singapore,,,
44,pm70,Braddell H.K. Pastries (109 Lorong 1 Toa Payoh),Cakes,4.6,100,Singapore,109 Lorong 1 Toa Payoh Singapore,12.0,1.3412219,103.84635374505879
45,x4oe,Stackz (Zhongshan Mall),Western,4.4,100,Singapore,Zhongshan Mall Singapore,,1.3272079,103.8464351
46,pgmh,ThaiTai 泰太 X brand (20 Ah Hood Rd),Asian,3.0,20,Singapore,20 Ah Hood Rd Singapore,,1.32715435,103.84649169569519
47,d3az,21 on Rajah (Aloft Singapore Novena),Mediterranean,4.4,27,Singapore,Aloft Singapore Novena Singapore,11.0,1.3269777,103.8473659
48,zp32,HanKki (Lor 6 Toa Payoh)- Islandwide Delivery,Korean,4.8,46,Singapore,Lor 6 Toa Payoh Singapore,12.0,,
49,v8un,El Cocinero (Novena),Mexican,4.5,500,Singapore,Novena Singapore,11.0,1.3231845,103.8370863
50,x4wt,La Café & Bar (Royal Square Novena),Western,4.4,100,Singapore,Royal Square Novena Singapore,11.0,1.3207567,103.8430286
51,x2hs,Turkish Kebab (Lorong 6 Toa Payoh),Shawarma,4.3,500,Singapore,Lorong 6 Toa Payoh Singapore,12.0,1.3363167982624686,103.85541327572213
52,w5ov,Bari-Uma Ramen (Novena),Ramen,4.8,100,Singapore,Novena Singapore,11.0,1.3231845,103.8370863
53,v9hj,470 Mini Wok (Lorong 7 Toa Payoh),Chinese,4.6,2000,Singapore,Lorong 7 Toa Payoh Singapore,12.0,1.3366842537296393,103.8569644818215
54,y5kr,Pot Yummy Yummy (480 Toa Payoh Gourmet Paradise By Koufu),Noodles,3.1,19,Singapore,480 Toa Payoh Gourmet Paradise By Koufu Singapore,12.0,,
55,v8xy,ThaiLily Restaurant (Toa Payoh),Thai,3.8,500,Singapore,Toa Payoh Singapore,12.0,1.3353906,103.8497414
56,w2sy,Mademoiselle Tang Noodle唐大小姐过桥米线 (Royal Square Novena),Chinese,4.8,1000,Singapore,Royal Square Novena Singapore,11.0,1.3207567,103.8430286
57,xa9p,The Coffee Affaire (Royal Square @ Novena),Coffee,2.4,5,Singapore,Royal Square @ Novena Singapore,11.0,1.3207567,103.8430286
58,z2px,Rice Noodle Queen (Gourmet Paradise HDB Hub),Noodles,3.8,42,Singapore,Gourmet Paradise HDB Hub Singapore,,,
59,s7oz,Sinn Ji Hainanese Chicken Rice (Thomson V),Chicken Rice,4.5,2000,Singapore,Thomson V Singapore,11.0,1.3534286,103.83557399679276
60,sykq,Prawnography Novena Gardens ( THOMSON),Hokkien Mee,3.7,65,Singapore, THOMSON Singapore,11.0,1.3777158,103.8295243
61,t3xm,Chicken Hotpot (Novena),Chinese,4.4,100,Singapore,Novena Singapore,11.0,1.3231845,103.8370863
62,v9eu,Thai'D Me Up (Bukit Timah Road),Thai,4.7,500,Singapore,Bukit Timah Road Singapore,10.0,1.3322848500000002,103.79346285
63,znf1,Steam Rice Kitchen 蒸有米 (Toa Payoh),Asian,4.9,28,Singapore,Toa Payoh Singapore,12.0,1.3353906,103.8497414
64,g6ay,SHINCHAN WESTERN FOOD (95 Lor 4 Toa Payoh),Western,4.0,92,Singapore,95 Lor 4 Toa Payoh Singapore,12.0,,
65,t0xx,Aroy Chatuchak (Toa Payoh Central),Chicken,4.5,100,Singapore,Toa Payoh Central Singapore,12.0,1.3353906,103.8497414
66,i1yk,Ton Coffee (10 Sinaran Drive),Vietnamese,4.7,2,Singapore,10 Sinaran Drive Singapore,,1.3206362,103.84418667335355
67,v3pp,Xin Arginoko Japanese & Korean Cuisine (Toa Payoh),Japanese,4.3,100,Singapore,Toa Payoh Singapore,12.0,1.3353906,103.8497414
68,zqpm,BBQ Seoul Shokudo (Velocity Novena Square),Korean,3.8,2,Singapore,Velocity Novena Square Singapore,11.0,1.3197981,103.84404339860015
69,x6cl,Fruits & Juices (Koufu 470 TPY),Beverages,4.8,70,Singapore,Koufu 470 TPY Singapore,,,
70,o166,Kim Keat Hokkien Mee (92 Toa Payoh Lorong 4),Hokkien Mee,4.5,12,Singapore,92 Toa Payoh Lorong 4 Singapore,12.0,1.33804655,103.8494301
71,u8lk,Roselio's Kitchen (Toa Payoh),Filipino,4.0,1,Singapore,Toa Payoh Singapore,12.0,1.3353906,103.8497414
72,x1zc,Mun Zuk满粥 (Velocity@Novena Square),Porridge,4.5,1000,Singapore,Velocity@Novena Square Singapore,11.0,1.3197981,103.84404339860015
73,g4j2,THREE. by Garamika (Toa Payoh),Grill,5.0,38,Singapore,Toa Payoh Singapore,12.0,1.3353906,103.8497414
74,s2ny,Smiths Authentic British Fish & Chips (Bukit Timah Road),Snacks,4.4,1000,Singapore,Bukit Timah Road Singapore,10.0,1.3322848500000002,103.79346285
75,hvrw,Il Piccolo Pizzeria (Toa Payoh Central),Pasta,3.9,100,Singapore,Toa Payoh Central Singapore,12.0,1.3353906,103.8497414
76,bsnj,Mentai-Ya Japanese Cuisine (Toa Payoh Central),Rice Dishes,4.8,100,Singapore,Toa Payoh Central Singapore,12.0,1.3353906,103.8497414
77,m6i4,Maji Curry (10 Sinaran Drive),Japanese,5.0,63,Singapore,10 Sinaran Drive Singapore,,1.3206362,103.84418667335355
78,tcik,FAM Roasted (411 Balestier),Chinese,4.8,36,Singapore,411 Balestier Singapore,12.0,1.32558795,103.84903164972782
79,w1pt,Macpherson Ah Liang BBQ Seafood (Balestier),Seafood,4.0,100,Singapore,Balestier Singapore,12.0,1.326226,103.8473149
80,f1je,Heng Kee Teochew Porridge Rice (Toa Payoh),Chinese,4.6,500,Singapore,Toa Payoh Singapore,12.0,1.3353906,103.8497414
81,v8ql,Rochor Beancurd House (Balestier),Dessert,4.7,1000,Singapore,Balestier Singapore,12.0,1.326226,103.8473149
82,v3ii,TungLok Teahouse (Square 2),Chinese,4.5,100,Singapore,Square 2 Singapore,,1.3206362,103.84418667335355
83,v1kj,Lao Beijing (Square 2),Chinese,4.5,100,Singapore,Square 2 Singapore,,1.3206362,103.84418667335355
84,x2om,Meat You Here (Balmoral Plaza),Western,4.6,100,Singapore,Balmoral Plaza Singapore,,1.3164924999999998,103.83545604508063
85,v9ru,Yuet Sing Seafood (Toa Payoh),Chinese,3.9,500,Singapore,Toa Payoh Singapore,12.0,1.3353906,103.8497414
86,y7cf,Secret Recipe (HDB Hub),Cakes,4.7,100,Singapore,HDB Hub Singapore,,1.3317686,103.848557
87,p0bg,Ding Ji by Fei Siong Group (Toa Payoh 184),Noodles,4.1,100,Singapore,Toa Payoh 184 Singapore,12.0,1.33257,103.84965604930872
88,nwfg,Xiao Pang Niu Korean (Novena Square),Korean,3.1,47,Singapore,Novena Square Singapore,11.0,1.3199568,103.8436638
89,x7hr,Uncle Fatt (Bukit Timah Road),Fried Rice,4.3,61,Singapore,Bukit Timah Road Singapore,10.0,1.3322848500000002,103.79346285
90,xe2y,Aryan’s Grace Of India @ A Authentic Indian and Lebanese cuisine In Central area - Restaurant Delivery,Indian,1.8,35,Singapore,,,46.3144754,11.0480288
91,k37k,Knockhouse Cafe (Yew Lian Park),Seafood,2.7,11,Singapore,Yew Lian Park Singapore,,1.3956042,103.7520501374193
92,w7kc,Ba Shu Jia Chang Cai (Balestier Market),Chinese,4.7,500,Singapore,Balestier Market Singapore,12.0,1.32558795,103.84903164972782
93,ao9i,Hadya’s Kebab & Grill Corner @ Thomson Road - Restaurant Delivery,Indian,3.4,19,Singapore,,,46.3144754,11.0480288
94,x4ek,R&B Tea (United Square),Bubble Tea,4.7,500,Singapore,United Square Singapore,,1.3172579500000001,103.8436008937355
95,y9lz,Hoshino Coffee (United Square),Japanese,4.5,100,Singapore,United Square Singapore,,1.3172579500000001,103.8436008937355
96,x3gy,VIET LAP (United Square),Pho,3.5,100,Singapore,United Square Singapore,,1.3172579500000001,103.8436008937355
97,dtei,The Clueless Goat Speciality Coffee House (Thomson Road),Coffee,4.3,41,Singapore,Thomson Road Singapore,11.0,1.321708358812433,103.84183590346154
98,wwh2,Royal Spices & Curry Indian Muslim Food (Jalan Pemimpin),Indian,4.3,6,Singapore,Jalan Pemimpin Singapore,,1.347980366273595,103.84075783321418
99,x5vc,Cool Cup (Toa Payoh North),Pancakes and Waffles,4.5,100,Singapore,Toa Payoh North Singapore,12.0,1.3416548000000001,103.8464593736629
100,eh8d,Fatboy's The Burger Bar (Upper Thomson) - Islandwide Delivery,American,4.2,100,Singapore,Upper Thomson Singapore,11.0,1.35463855,103.83251239866786
101,x7qi,Royal Biryani (Novena),Indian,4.1,500,Singapore,Novena Singapore,11.0,1.3231845,103.8370863
102,l9hp,SOD Cafe (Upper Thomson),Western,4.8,100,Singapore,Upper Thomson Singapore,11.0,1.35463855,103.83251239866786
103,v0yq,Hong Kong Day (Goldhill Shopping Centre),Thai,4.5,500,Singapore,Goldhill Shopping Centre Singapore,,1.3187117,103.843508
104,oczz,The Pakistani Briyani & Curry Culture/ Indian & Pakistani Restaurant (159 Thomson Rd) - Restaurant Delivery,Indian,3.3,100,Singapore,159 Thomson Rd Singapore,11.0,1.3180512000000002,103.8436872
105,fhrx,Bombay Bites (Goldhill Shopping Centre) - Restaurant Delivery,Indian,2.4,35,Singapore,Goldhill Shopping Centre Singapore,,1.3187117,103.843508
106,w1bb,Proofer Bakery & Pizzeria (United Square),Pizza,4.6,100,Singapore,United Square Singapore,,1.3172579500000001,103.8436008937355
107,zhio,Fukudon (Koufu @ Novena Square),Rice Dishes,4.6,65,Singapore,Koufu @ Novena Square Singapore,11.0,,
108,t602,New Ubin Seafood (MYMCA Stevens),Chinese,4.2,100,Singapore,MYMCA Stevens Singapore,,,
109,deid,"Soul Of India @ North Indian, Middle Eastern Restaurant - Restaurant Delivery",Indian,2.5,91,Singapore,,,46.3144754,11.0480288
110,jzxo,Nazeer Bhai Indian Muslim Food (73 Toa Payoh Lorong 4),Indian,4.1,100,Singapore,73 Toa Payoh Lorong 4 Singapore,12.0,1.3340008,103.8512588
111,rznf,Pot Yummy Yummy Lei Cha Pao Fan(Velocity@Novena Square),Asian,3.9,51,Singapore,Velocity@Novena Square Singapore,11.0,1.3197981,103.84404339860015
112,xznz,Mint Leaf of Mumbai @United Square - Restaurant Delivery,Indian,2.9,71,Singapore,,,46.3144754,11.0480288
113,us3u,Soup Dayz (United Square),Soups,4.5,100,Singapore,United Square Singapore,,1.3172579500000001,103.8436008937355
114,o43y,Smoked Burgers By Dreamshop (Stevens Road),American,2.9,47,Singapore,Stevens Road Singapore,,1.31991405,103.82616810871971
115,pur9,The London Curry House (159 Thomson Rd) - Restaurant Delivery,Indian,2.7,77,Singapore,159 Thomson Rd Singapore,11.0,1.3180512000000002,103.8436872
116,q5o8,Royal Biryani (159 Thomson Rd)- Restaurant Delivery,Indian,3.3,69,Singapore,159 Thomson Rd Singapore,11.0,1.3180512000000002,103.8436872
117,eyyy,Pot Yummy Yummy Fish Soup Ban Mian(Velocity@Novena Square),Asian,4.3,9,Singapore,Velocity@Novena Square Singapore,11.0,1.3197981,103.84404339860015
118,hmpv,FLAME N GRILL @ THOMSON ROAD/LEBANESE & INDIAN RESTAURANT - Restaurant Delivery,Indian,2.0,54,Singapore,,,46.3144754,11.0480288
119,ezsn,Menya Aoi (United Square),Japanese,4.7,14,Singapore,United Square Singapore,,1.3172579500000001,103.8436008937355
120,zjuk,The Royal Afghan curry & Biryani Hub@Newton Road - Restaurant Delivery,Indian,2.4,46,Singapore,,,46.3144754,11.0480288
121,g9to,4 EYES GUYS KITCHEN (UPPER THOMSON),Chinese,4.2,66,Singapore,UPPER THOMSON Singapore,11.0,1.35463855,103.83251239866786
122,obo1,Jai Thai Restaurant (Clover Way),Seafood,4.7,72,Singapore,Clover Way Singapore,,1.349519985106274,103.84358319764942
123,w3sv,Xiang Dessert & Food 饗好吃 (Upper Thomson Road),Chinese,4.5,1000,Singapore,Upper Thomson Road Singapore,11.0,1.3980525521561984,103.81795642248994
124,s3uq,Balestier Bak Kut Teh (Balestier Road),Bak Kut Teh,4.6,3000,Singapore,Balestier Road Singapore,12.0,1.3181005488832067,103.85551719932096
125,scg5,Ee Han Kuey Tiao Kai (Balestier Road),Singaporean,4.5,100,Singapore,Balestier Road Singapore,12.0,1.3181005488832067,103.85551719932096
126,gh9u,Parivar - Vegetarian and Non Vegetarian Indian (Toa Payoh North),Indian,3.7,16,Singapore,Toa Payoh North Singapore,12.0,1.3416548000000001,103.8464593736629
127,s5be,TWB Pizza and Bar (Upper Thomson),Pizza,4.4,100,Singapore,Upper Thomson Singapore,11.0,1.35463855,103.83251239866786
128,dxep,Wicked Wings (Bishan),Fried Chicken,2.9,40,Singapore,Bishan Singapore,20.0,1.3519117,103.8489708
129,xkri,Vietnam Kitchen (Bishan),Vietnamese,4.9,7,Singapore,Bishan Singapore,20.0,1.3519117,103.8489708
130,ymby,Biang Biang Noodles Xi An Famous Food (Shaw Plaza),Chinese,2.9,5,Singapore,Shaw Plaza Singapore,,1.32495655,103.85112396305036
131,im05,sibarita (9 Sin Ming Rd),Mexican,4.7,2,Singapore,9 Sin Ming Rd Singapore,,1.3532399499999999,103.83550650966735
132,hki1,Enjoy Eating House and Bar (Stevens),Seafood,4.7,89,Singapore,Stevens Singapore,,1.31991405,103.82616810871971
133,h8ok,WAH & STEVEN'S CORNER (UPPER THOMSON),Dim Sum ,4.0,17,Singapore,UPPER THOMSON Singapore,11.0,1.35463855,103.83251239866786
134,z08g,Ontama Don (Shaw Plaza),Japanese,4.5,20,Singapore,Shaw Plaza Singapore,,1.32495655,103.85112396305036
135,l9kj,Huolala Mala Specialist 火辣辣麻辣专家 (Upper Thomson),Mala Xiang Guo,4.3,500,Singapore,Upper Thomson Singapore,11.0,1.35463855,103.83251239866786
136,pyfp,TwoBakeBoys (Shaw Plaza) - Islandwide Delivery,Dessert,5.0,5,Singapore,Shaw Plaza Singapore,,1.32495655,103.85112396305036
137,bzpa,Hyderabad Authentic North Indian Restaurant (Toa Payoh),Indian,4.0,80,Singapore,Toa Payoh Singapore,12.0,1.3353906,103.8497414
138,p39t,Dongbei Mala Tang 东北麻辣烫 (Balestier),Asian,4.0,1,Singapore,Balestier Singapore,12.0,1.326226,103.8473149
139,x0kk,Loy Kee Best Chicken Rice (Balestier),Chicken Rice,4.4,500,Singapore,Balestier Singapore,12.0,1.326226,103.8473149
140,v0ye,Daawat Tandoori Restaurant (Yew Lain Park),Indian,4.3,1000,Singapore,Yew Lain Park Singapore,,,
141,wiar,Chong Qing Grilled Fish (Upper Thomson) - Islandwide Delivery,Chinese,4.6,28,Singapore,Upper Thomson Singapore,11.0,1.35463855,103.83251239866786
142,xjsp,Hyderabad Bawarchi North Indian Cuisine (Toa Payoh North),Indian,4.6,29,Singapore,Toa Payoh North Singapore,12.0,1.3416548000000001,103.8464593736629
143,xmyg,Al-Julekha North Indian Cuisine (Toa Payoh North),Indian,3.6,95,Singapore,Toa Payoh North Singapore,12.0,1.3416548000000001,103.8464593736629
144,y2a0,Nam Kee Chicken Rice (200 Upper Thomson Road),Chicken,4.4,100,Singapore,200 Upper Thomson Road Singapore,11.0,1.35190425,103.83607020275849
145,kyjn,Dongbei Chuan Cai 东北川菜 (Balestier Road),Asian,4.0,79,Singapore,Balestier Road Singapore,12.0,1.3181005488832067,103.85551719932096
146,laff,The Plant Food (Thomson V Two),Vegetarian,4.4,100,Singapore,Thomson V Two Singapore,11.0,1.3534286,103.83557399679276
147,zu0e,Two Broke Guys (Bishan Street 12),Cakes,4.6,29,Singapore,Bishan Street 12 Singapore,20.0,1.3453051568430943,103.85244450095817
148,zyrf,San Ren Xing (Thomson Plaza) - Islandwide Delivery,Chinese,3.3,21,Singapore,Thomson Plaza Singapore,11.0,1.35454475,103.83082063425525
149,v26v,Nana Curry (Thomson Plaza),Chinese,3.4,90,Singapore,Thomson Plaza Singapore,11.0,1.35454475,103.83082063425525
150,qhqr,Indian Curry And Tandoor North Indian Mughlai (Toa Payoh North) - Restaurant Delivery,Indian,3.4,47,Singapore,Toa Payoh North Singapore,12.0,1.3416548000000001,103.8464593736629
151,s503,Teochew Seafood White Meehoon (Toa Payoh Lorong 8),Seafood,4.4,84,Singapore,Toa Payoh Lorong 8 Singapore,12.0,1.33482375,103.85936782100526
152,f3zg,Yen Izakaya 円居酒屋 (Thomson V Two),Japanese,4.5,100,Singapore,Thomson V Two Singapore,11.0,1.3534286,103.83557399679276
153,cc1i,Mirch House North Indian Cuisine (Toa Payoh North) - Restaurant Delivery,Indian,4.4,40,Singapore,Toa Payoh North Singapore,12.0,1.3416548000000001,103.8464593736629
154,yvf7,Paradise Biryani House -Indian Restaurant (978 Toa Payoh North) - Restaurant Delivery,Indian,2.5,9,Singapore,978 Toa Payoh North Singapore,12.0,1.3416548000000001,103.8464593736629
155,lb8g,Banh Mi Bae (Balestier),Korean,3.5,13,Singapore,Balestier Singapore,12.0,1.326226,103.8473149
156,v1tg,The Roti Prata House (Upper Thomson Road),Indian,4.4,3000,Singapore,Upper Thomson Road Singapore,11.0,1.3980525521561984,103.81795642248994
157,x5as,Jing House Yong Tau Foo (Koufu Thomson Plaza),Ban Mian,4.6,100,Singapore,Koufu Thomson Plaza Singapore,11.0,,
158,faxs,Aher Soup 阿2煲靓汤 (Koufu Thomson Plaza),Soups,4.6,100,Singapore,Koufu Thomson Plaza Singapore,11.0,,
159,g508,Homewok (Thomson Plaza),Chinese,4.2,100,Singapore,Thomson Plaza Singapore,11.0,1.35454475,103.83082063425525
160,vjxq,Chop Steak Western Cuisine (Sin Ming),Western,4.6,100,Singapore,Sin Ming Singapore,,1.3590773,103.8351214
161,krxz,ASTONS Specialities (Thomson Plaza),Grill,4.4,100,Singapore,Thomson Plaza Singapore,11.0,1.35454475,103.83082063425525
162,ppck,Swathi -North Indian Cuisine (978 Toa Payoh North) - Restaurant Delivery,Indian,3.9,8,Singapore,978 Toa Payoh North Singapore,12.0,1.3416548000000001,103.8464593736629
163,wpfw,Hyderabad Bawarchi North Indian Cuisine (978 Toa Payoh North) - Restaurant Delivery,Indian,3.2,19,Singapore,978 Toa Payoh North Singapore,12.0,1.3416548000000001,103.8464593736629
164,mk0d,CJ Fried Chicken (Balestier),Chicken,4.7,66,Singapore,Balestier Singapore,12.0,1.326226,103.8473149
165,oi2m,Wonton Mama (Thomson) - Islandwide Delivery,Thai,4.9,8,Singapore,Thomson Singapore,11.0,1.3777158,103.8295243
166,quxk,Al-Rabeca Restaurant (Kim Keat Road),Indian,3.6,95,Singapore,Kim Keat Road Singapore,,1.3270688637017254,103.8552399760322
167,tk3p,HENG LONG TEOCHEW PORRIDGE (UPPER THOMSON RD),Chinese,4.7,96,Singapore,UPPER THOMSON RD Singapore,11.0,1.3980525521561984,103.81795642248994
168,cei3,Parivar -Vegetarian and Non Vegetarian Indian (978 Toa Payoh North) - Restaurant Delivery,Indian,3.4,30,Singapore,978 Toa Payoh North Singapore,12.0,1.3416548000000001,103.8464593736629
169,v2su,Tomyum Mama (Upper Thomson Road),Thai,4.6,2000,Singapore,Upper Thomson Road Singapore,11.0,1.3980525521561984,103.81795642248994
170,x7mk,Soon Hock Hokkien Mee (Sin Ming 23 Coffeeshop),Noodles,4.6,1000,Singapore,Sin Ming 23 Coffeeshop Singapore,,,
171,w8rl,Siam Kitchen (SAFRA Toa Payoh),Thai,4.1,100,Singapore,SAFRA Toa Payoh Singapore,12.0,1.33021315,103.85468164279789
172,zeus,Newton Tian Xiang Big Prawn Noodle (Newton Food Centre),Singaporean,4.1,100,Singapore,Newton Food Centre Singapore,11.0,1.3121232,103.83972339469418
173,oxmi,Hyderabad Authentic North Indian Restaurant (Toa Payoh) - Restaurant Delivery,Indian,3.3,78,Singapore,Toa Payoh Singapore,12.0,1.3353906,103.8497414
174,tlbn,Wine Mansion (Thomson Plaza),Pizza,2.8,4,Singapore,Thomson Plaza Singapore,11.0,1.35454475,103.83082063425525
175,ycvw,AKBAR DARBAR INDIAN RESTAURANT (978 Toa Payoh North) - Restaurant Delivery,Indian,4.0,17,Singapore,978 Toa Payoh North Singapore,12.0,1.3416548000000001,103.8464593736629
176,dksf,Newton Mee Goreng Streetall Goreng Combo Specialist (Newton Food Centre),Indian,3.3,26,Singapore,Newton Food Centre Singapore,11.0,1.3121232,103.83972339469418
177,v3tx,Wang Cafe (Thomson Plaza),Kaya Toast,4.3,500,Singapore,Thomson Plaza Singapore,11.0,1.35454475,103.83082063425525
178,slrg,Pung Pung Kitchen (Sin Ming Road) - Islandwide Delivery,Chinese,2.9,4,Singapore,Sin Ming Road Singapore,,1.3595560500000001,103.83972955
179,cr37,Nhung Kitchen (Balestier Point),Vietnamese,4.6,100,Singapore,Balestier Point Singapore,12.0,1.32269905,103.8520400695597
180,eucd,Mr Doner Kebab (Thomson Plaza),Turkish,4.8,10,Singapore,Thomson Plaza Singapore,11.0,1.35454475,103.83082063425525
181,mqd2,Sin Ming Roti Prata (24 Sin Ming Rd) - Islandwide Delivery,Sandwiches,2.9,23,Singapore,24 Sin Ming Rd Singapore,,1.355529,103.8364516
182,g3vq,Tea Dojo (18 Toa Payoh Lorong 7),Tea,4.5,92,Singapore,18 Toa Payoh Lorong 7 Singapore,12.0,1.33573895,103.85682132260615
183,l1gz,Hua Zai Roasted Duck (19 Toa Payoh),Chinese,2.5,14,Singapore,19 Toa Payoh Singapore,12.0,1.33521525,103.85652363668906
184,otsl,Odeon Beef Noodles (Food Junction - Junction 8),Noodles,4.3,66,Singapore,Food Junction - Junction 8 Singapore,,,
185,uq55,Wonderful La Mian Xiao Long Bao (Bishan),Dim Sum ,4.8,100,Singapore,Bishan Singapore,20.0,1.3519117,103.8489708
186,y2ny,Newton 51 (Newton Food Centre),Hokkien Mee,4.2,500,Singapore,Newton Food Centre Singapore,11.0,1.3121232,103.83972339469418
187,tjgv,Jiak Mee@Traditional Mee Hoon Kueh (Bishan Street 13),Asian,2.9,8,Singapore,Bishan Street 13 Singapore,20.0,1.34714895,103.8545532
188,npus,Sin Kee Chicken Rice (Bukit Timah Road),Asian,4.8,27,Singapore,Bukit Timah Road Singapore,10.0,1.3322848500000002,103.79346285
189,f0vg,川香小厨 Chuan Xiang Xiao Chu (Toa Payoh BLK 22),Chinese,4.7,100,Singapore,Toa Payoh BLK 22 Singapore,12.0,,
190,wmbz,Divine Chicken Pot (Food Junction - Junction 8),Curry,4.7,67,Singapore,Food Junction - Junction 8 Singapore,,,
191,x1rc,61 Curry Chicken (Whampoa Makan Place),Curry,4.3,70,Singapore,Whampoa Makan Place Singapore,,1.32310355,103.8549980349569
192,fzys,Newton Old Signboard 25 (Newton Food Centre),Hokkien Mee,4.3,100,Singapore,Newton Food Centre Singapore,11.0,1.3121232,103.83972339469418
193,p9sw,Seabay Delight (Food Junction - Junction 8),Malaysian,3.8,100,Singapore,Food Junction - Junction 8 Singapore,,,
194,x1sq,Four Seasons Ching Teng (Toa Payoh Lorong 8),Noodles,4.8,45,Singapore,Toa Payoh Lorong 8 Singapore,12.0,1.33482375,103.85936782100526
