,StoreId,CompleteStoreName,FoodType,AverageRating,Reviewers,City,Location,District,Latitude,Longitude
3989,s4hh,Madrinaa Italiano (Chip Bee Garden),Pizza,4.2,100,Singapore,Chip Bee Garden Singapore,,,
3990,l8ga,Hong Kong Street Tien Heong (Nex),Chinese,3.8,78,Singapore,Nex Singapore,,1.3505193,103.87225329837344
3991,o8hc,Supreme Pork Chop Rice 一品排骨饭 (Beach Road),Chicken,4.5,100,Singapore,Beach Road Singapore,6.0,1.2956933488103999,103.85568665170956
3992,g0jv,Soi Thai Soi Nice (Raffles City Shopping Centre) - Islandwide Delivery,Thai,5.0,1,Singapore,Raffles City Shopping Centre Singapore,1.0,1.2938961,103.85334282751231
3993,v2es,Original Sin (Chip Bee Garden) (pandago),Mediterranean,4.5,100,Singapore,Chip Bee Garden Singapore,,,
3994,tral,The Dabbawalla (Quayside),Indian,4.3,64,Singapore,Quayside Singapore,,1.2479779,103.84169824922753
3995,y9zn,Publico Ristorante (Robertson Quay),Pizza,4.4,100,Singapore,Robertson Quay Singapore,,1.2911343,103.8372528
3996,y9ex,Aburiya - Zombie,Japanese,4.8,27,Singapore,,,46.3144754,11.0480288
3997,alok,Soll (Sunset On 11),American,4.3,2,Singapore,Sunset On 11 Singapore,,,
3998,qgns,Rosso Vino (15 Merbau Rd) - Islandwide Delivery,Pizza,4.5,9,Singapore,15 Merbau Rd Singapore,,1.2911796999999998,103.84199502304722
3999,qrs9,Donburi King (NEX) - Islandwide Delivery,Japanese,4.0,1,Singapore,NEX Singapore,,1.3505193,103.87225329837344
4000,y9gh,Chinatown Tan's Tutu (Nex),Singaporean,4.7,100,Singapore,Nex Singapore,,1.3505193,103.87225329837344
4001,qavh,Three Buns (Quay Side) - Islandwide Delivery,American,4.5,75,Singapore,Quay Side Singapore,,,
4002,c0zz,Wanoniku (Ang Mo Kio Avenue 5),Japanese,4.5,28,Singapore,Ang Mo Kio Avenue 5 Singapore,20.0,1.37598685,103.852695
4003,x3vm,Chuang Yi Claypot Delights (Coffee Sense),Rice Dishes,4.6,100,Singapore,Coffee Sense Singapore,,,
4004,wdzi,Tamako Meal (Casuarina Road) - Islandwide Delivery,Japanese,4.0,1,Singapore,Casuarina Road Singapore,,1.3773517841067577,103.82791732332511
4005,x6ek,Indonesian Food - Xiang Ge Li (70 Serangoon Garden Way),Indonesian,4.1,1000,Singapore,70 Serangoon Garden Way Singapore,12.0,1.3623458,103.87330075
4006,smp8,Buey Tahan Cafeteria (574 AMK Ave 10),Grill,4.4,100,Singapore,574 AMK Ave 10 Singapore,20.0,,
4007,e6px,LiHO TEA (Kallang MRT),Bubble Tea,4.8,100,Singapore,Kallang MRT Singapore,,,
4008,spdv,Kin Sen Thai Noodle,Noodles,5.0,12,Singapore,,,46.3144754,11.0480288
4009,y7bq,Go Greek by Zorba (Clarke Quay),Salads,4.3,69,Singapore,Clarke Quay Singapore,,1.2903938,103.8454241
4010,y4jy,SANPOUTEI (Holland),Ramen,4.4,100,Singapore,Holland Singapore,10.0,52.513101618228255,5.066477642886801
4011,v0ap,Sufood (Raffles City),Vegetarian,4.5,70,Singapore,Raffles City Singapore,1.0,1.2933906,103.85325565
4012,vfip,Summer Folks Cafe & Steakhouse (Beach Road),American,4.6,99,Singapore,Beach Road Singapore,6.0,1.2956933488103999,103.85568665170956
4013,v0sp,SENS Dining (Holland Avenue),Seafood,4.4,100,Singapore,Holland Avenue Singapore,10.0,1.3087962499999999,103.7950227
4014,mx3y,Hong Li Fried King 鸿利小炒王 (Upper Boon Keng Road),Chinese,3.6,4,Singapore,Upper Boon Keng Road Singapore,,1.3177300497076851,103.87285981134245
4015,chkp,PizzaExpress (Holland Village) - Islandwide Delivery,Pizza,4.4,24,Singapore,Holland Village Singapore,10.0,1.3126017,103.7971262
4016,f7pv,Long Beach (Robertson Quay),Seafood,4.8,47,Singapore,Robertson Quay Singapore,,1.2911343,103.8372528
4017,y4gz,Apollo Coffee Bar (Serangoon Garden Way),Coffee,4.5,100,Singapore,Serangoon Garden Way Singapore,12.0,1.3623458,103.87330075
4018,j7xy,Famous Treasure (City Hall),Chinese,4.1,34,Singapore,City Hall Singapore,6.0,1.2930272,103.85264479617268
4019,oxl3,Somboon Thai Cuisine (Bukit Merah),Thai,2.3,10,Singapore,Bukit Merah Singapore,,1.2704395,103.82831840371266
4020,m9lu,The Coffee Academics (Raffles City),Coffee,4.6,69,Singapore,Raffles City Singapore,1.0,1.2933906,103.85325565
4021,ezew,Sugarkoh (Holland Piazza),Beverages,5.0,5,Singapore,Holland Piazza Singapore,10.0,1.3104501,103.79515826369922
4022,v3zz,Verve Pizza Bar (River Valley Road),Pizza,3.9,100,Singapore,River Valley Road Singapore,9.0,1.2942715,103.84200435
4023,wr05,SunYou Bistro (Lorong Mambong),Japanese,5.0,2,Singapore,Lorong Mambong Singapore,,1.311782367479644,103.79443377601687
4024,krjn,88 Seoul BBQ (Serangoon),Korean,2.6,15,Singapore,Serangoon Singapore,12.0,1.3497610500000001,103.87368414801405
4025,y7rj,Tat Lee Seafood (204 Serangoon Central),Seafood,4.5,100,Singapore,204 Serangoon Central Singapore,12.0,1.35276955,103.87298630331716
4026,tw5q,87 Just Thai (Holland Village),Thai,4.8,98,Singapore,Holland Village Singapore,10.0,1.3126017,103.7971262
4027,v2eh,Holland Bar L'Operetta (Holland Village),Pizza,4.2,100,Singapore,Holland Village Singapore,10.0,1.3126017,103.7971262
4028,ogln,Pergola (Swiss Club),Indian,3.9,18,Singapore,Swiss Club Singapore,,1.3429964,103.7906466
4029,m5uo,Lai Lai Xing Fishball Noodle (Ang Mo Kio Avenue 10),Noodles,4.3,100,Singapore,Ang Mo Kio Avenue 10 Singapore,20.0,1.35989735,103.8554889
4030,e2e1,Hakka Taste (Ang Mo Kio Avenue 5),Grill,2.8,22,Singapore,Ang Mo Kio Avenue 5 Singapore,20.0,1.37598685,103.852695
4031,q9ov,204 Braised Duck (Serangoon Central),Malaysian,3.7,79,Singapore,Serangoon Central Singapore,12.0,1.3535142,103.8716163518423
4032,b8rl,Wang Dae Bak Grill (Holland Village),Korean,4.5,100,Singapore,Holland Village Singapore,10.0,1.3126017,103.7971262
4033,x6ua,Ann Chin Handmade Popiah (Serangoon),Singaporean,4.6,100,Singapore,Serangoon Singapore,12.0,1.3497610500000001,103.87368414801405
4034,y8wu,Tokyo Sundubu (Raffles City),Japanese,4.7,60,Singapore,Raffles City Singapore,1.0,1.2933906,103.85325565
4035,bbx4,RASOI -THE INDIAN KITCHEN (33 Lorong Liput) - Islandwide Delivery,Indian,4.9,5,Singapore,33 Lorong Liput Singapore,,1.3106847,103.7950221
4036,d4vb,El Mesa (Clarke Quay),Filipino,4.7,52,Singapore,Clarke Quay Singapore,,1.2903938,103.8454241
4037,b6kk,527 Fried Carrot Cake (Ang Mo Kio Avenue 10),Dim Sum ,4.5,100,Singapore,Ang Mo Kio Avenue 10 Singapore,20.0,1.35989735,103.8554889
4038,xd4k,Want Food Taiwanese Delights (Lorong Liput),Asian,5.0,1,Singapore,Lorong Liput Singapore,,1.3107674216043392,103.79513072466887
4039,k98t,Ming Sheng Hong Kong Roasted (Ang Mo Kio Ave 8),Salads,5.0,1,Singapore,Ang Mo Kio Ave 8 Singapore,20.0,1.378022491361517,103.8475569397299
4040,v5it,Wala Wala Cafe Bar (Lorong Mambong),Pizza,4.6,100,Singapore,Lorong Mambong Singapore,,1.311782367479644,103.79443377601687
4041,vbzc,Bella Italia Pizzeria Ristorante (myVillage Serangoon Garden),Pizza,4.3,16,Singapore,myVillage Serangoon Garden Singapore,12.0,,
4042,s1zm,Baden Restaurant & Pub  (Lorong Mambong),Singaporean,4.4,96,Singapore,Lorong Mambong Singapore,,1.311782367479644,103.79443377601687
4043,x9qb,Princess Terrace Cafe (Havelock Road),Singaporean,3.4,15,Singapore,Havelock Road Singapore,,1.2892162159957092,103.84015371528498
4044,x8hx,Heng Heng Seafood (Havelock Road),Noodles,4.4,88,Singapore,Havelock Road Singapore,,1.2892162159957092,103.84015371528498
4045,v8um,Gik Gik Heng Prawn Mee & Lor Mee 日日興虾面卤面 (Ang Mo Kio Avenue 10),Noodles,4.4,500,Singapore,Ang Mo Kio Avenue 10 Singapore,20.0,1.35989735,103.8554889
4046,gvzh,Hanjip Korean Grill House (River Valley),Soups,4.5,45,Singapore,River Valley Singapore,9.0,1.2976832,103.834188
4047,sk9r,Ange Bakes Keto (High Street Plaza),Cakes,4.8,56,Singapore,High Street Plaza Singapore,6.0,1.29047655,103.84933865021998
4048,q3jl,Traditional Hai Nam Fang Yuan Satay (Chomp Chomp Food Centre),Chicken Wings,3.9,100,Singapore,Chomp Chomp Food Centre Singapore,,1.3642229,103.8665495110119
4049,ibr9,"Wang BBQ - Lok Lok, Chicken Wing & Satay (Chomp Chomp Food Centre)",Asian,4.7,94,Singapore,Chomp Chomp Food Centre Singapore,,1.3642229,103.8665495110119
4050,fe64,Aman Restaurant (Ang Mo Kio Avenue 8),Singaporean,4.9,42,Singapore,Ang Mo Kio Avenue 8 Singapore,20.0,1.378022491361517,103.8475569397299
4051,imz8,Queen Mookata & Fried Rice (Upper Aljunied),Asian,4.4,2,Singapore,Upper Aljunied Singapore,,1.3322646,103.8787188
4052,n0sp,Butter Bean (Funan Mall),Sandwiches,4.6,100,Singapore,Funan Mall Singapore,,1.291313,103.84994707397723
4053,uabn,Big Chicken Small Chicken (Suntec City),Fast Food,3.8,9,Singapore,Suntec City Singapore,,1.2942651,103.8591876
4054,vnuv,2am: dessertbar (21A Lor Liput) - Islandwide Delivery,Dessert,4.4,36,Singapore,21A Lor Liput Singapore,,,
4055,p9nt,442 Steamboat (136 Hong Kong Street Fish Head Steamboat),Seafood,4.2,100,Singapore,136 Hong Kong Street Fish Head Steamboat Singapore,,,
4056,w9q9,Wushiland Boba (Holland Vlg),Beverages,5.0,10,Singapore,Holland Vlg Singapore,10.0,,
4057,v1yi,Tea Co (Ang Mo Kio Avenue 8),Tea,4.7,100,Singapore,Ang Mo Kio Avenue 8 Singapore,20.0,1.378022491361517,103.8475569397299
4058,x6bn,Xin Lai Lai Seafood (Upper Aljunied Road),Chinese,4.3,100,Singapore,Upper Aljunied Road Singapore,,1.3322646,103.8787188
4059,w7by,All Bout Chicken (Chomp Chomp Food Centre),Fried Chicken,4.7,1000,Singapore,Chomp Chomp Food Centre Singapore,,1.3642229,103.8665495110119
4060,qsy2,Chick N’ Treat by Hoseh L Corp (20 Kensington Park Rd),Fried Chicken,2.9,6,Singapore,20 Kensington Park Rd Singapore,,1.3642229,103.8665495110119
4061,q0fl,The Warung (Chomp Chomp Food Centre),Malaysian,4.7,100,Singapore,Chomp Chomp Food Centre Singapore,,1.3642229,103.8665495110119
4062,kxx8,Wang Da Shen Chicken Wing & Satay (Chomp Chomp),Chicken Wings,4.5,100,Singapore,Chomp Chomp Singapore,,1.3642229,103.8665495110119
4063,rt5h,0126 Kitchen (Havelock Road Cooked Food Centre),Dim Sum ,5.0,1,Singapore,Havelock Road Cooked Food Centre Singapore,,1.28801455,103.82962173808303
4064,uziz,LaPasta (High Street Plaza),Italian,4.6,100,Singapore,High Street Plaza Singapore,6.0,1.29047655,103.84933865021998
4065,m7rc,Fat Bao Bao (High Street Plaza),Japanese,4.3,46,Singapore,High Street Plaza Singapore,6.0,1.29047655,103.84933865021998
4066,h77b,Twelve Hainanese Chicken Rice (Jalan Kukoh Food Centre),Chinese,3.8,17,Singapore,Jalan Kukoh Food Centre Singapore,,1.2882238,103.8399499
4067,hmff,Li Yang Mala Hotpot 立扬麻辣香锅 (Ang Mo Kio Avenue 8),Chinese,4.3,100,Singapore,Ang Mo Kio Avenue 8 Singapore,20.0,1.378022491361517,103.8475569397299
4068,u6mo,Western Hut (Havelock Road),Seafood,5.0,39,Singapore,Havelock Road Singapore,,1.2892162159957092,103.84015371528498
4069,slen,Tonkatsu ENbiton (Suntec City),Japanese,4.0,31,Singapore,Suntec City Singapore,,1.2942651,103.8591876
4070,e95x,DaBao Bento (High Street Plaza),Japanese,4.6,68,Singapore,High Street Plaza Singapore,6.0,1.29047655,103.84933865021998
4071,lodj,Golden Chicken (Suntec),Chicken Rice,3.0,7,Singapore,Suntec Singapore,,1.2935197999999999,103.85725715817814
4072,k17b,Petit Fangko (Margaret Market),Indonesian,4.7,5,Singapore,Margaret Market Singapore,,1.2977504999999998,103.80432904359057
4073,ptc0,Cake Patisserie (Anchorvale Crescent),Cakes,4.4,3,Singapore,Anchorvale Crescent Singapore,,1.3989323716683064,103.89263984367588
4074,y4qu,Soi 47 Thai Food (Clarke Quay Central),Thai,4.7,100,Singapore,Clarke Quay Central Singapore,,1.2903938,103.8454241
4075,sj3x,Putian Fusion (Suntec City),Chinese,3.8,11,Singapore,Suntec City Singapore,,1.2942651,103.8591876
4076,r2dc,Nor Nasi Ala Kampung (Margaret Drive),Malaysian,4.6,36,Singapore,Margaret Drive Singapore,,1.3000205,103.80312090000001
4077,u9yp,Smoof Acai (Macpherson),Healthy,5.0,4,Singapore,Macpherson Singapore,13.0,1.32620695,103.88950695393876
4078,q9ky,Bowen’s Cafe (Margaret Drive),Italian,4.7,5,Singapore,Margaret Drive Singapore,,1.3000205,103.80312090000001
4079,hrpz,Guang Dong Porridge (Margaret Drive),Porridge,3.9,11,Singapore,Margaret Drive Singapore,,1.3000205,103.80312090000001
4080,yffl,18 Seafood (Lorong Lew Lian),Chinese,2.9,39,Singapore,Lorong Lew Lian Singapore,,1.35042375,103.87720279999999
4081,x6ea,llaollao (Suntec City),Dessert,5.0,30,Singapore,Suntec City Singapore,,1.2942651,103.8591876
4082,nf09,回味蛋炒饭 HuiWei Egg Fried Rice (Outram Rd),Chinese,4.8,19,Singapore,Outram Rd Singapore,,1.280132051510667,103.83953171090924
4083,pnjs,Kelim Dakdoritang (Kensington Park),American,4.7,4,Singapore,Kensington Park Singapore,,1.3676522,103.86904198259782
4084,p3li,Tempat Makan Sha's (Outram Road),Malaysian,4.8,100,Singapore,Outram Road Singapore,,1.280132051510667,103.83953171090924
4085,eu16,Maguro O (Suntec City),Japanese,4.7,2,Singapore,Suntec City Singapore,,1.2942651,103.8591876
4086,x1bu,Chai?s Original Sliced Fish Soup (Food Republic - Suntec City),Seafood,4.8,99,Singapore,Food Republic - Suntec City Singapore,,1.2947403,103.8586307
4087,qicv,RITZ'S KITCHEN (56 Kallang Pudding),Malaysian,4.3,100,Singapore,56 Kallang Pudding Singapore,,1.328232,103.8791482
4088,apfd,Skewer Master ( Leng Kee Rd),Chinese,4.6,100,Singapore, Leng Kee Rd Singapore,,1.2905097,103.81382145
4089,s9d3,Myeongdong Kitchen (Ang Mo Kio),Singaporean,3.8,2,Singapore,Ang Mo Kio Singapore,20.0,1.369842,103.8466086
4090,a9pe,Al Hayat Indian Muslim Food (Serangoon Ave 4),Indian,3.9,500,Singapore,Serangoon Ave 4 Singapore,12.0,1.3581732418330699,103.87133072033144
4091,v1zo,Wanna Cuppa (Clarke Quay),Italian,4.2,100,Singapore,Clarke Quay Singapore,,1.2903938,103.8454241
4092,nhba,拌Ban (Malaban) (NYP Foodgle),Asian,4.9,6,Singapore,Malaban Singapore,,,
4093,shwz,Danlao (Ang Mo Kio),Chinese,5.0,10,Singapore,Ang Mo Kio Singapore,20.0,1.369842,103.8466086
4094,v2ji,G7 Sin Ma Live Seafood & Frog Porridge (Mountbatten),Porridge,4.3,500,Singapore,Mountbatten Singapore,,1.3063254,103.88272779279126
4095,z6in,Kin Hoi (Holland Close),Thai,4.7,41,Singapore,Holland Close Singapore,10.0,1.3071382,103.79624155
4096,naxt,MANAM (Upper Circular Road),Indian,4.7,28,Singapore,Upper Circular Road Singapore,,1.288711,103.84828505
4097,ty5x,Fu 福 (214 Serangoon Ave 4),Cakes,4.5,100,Singapore,214 Serangoon Ave 4 Singapore,12.0,1.3581732418330699,103.87133072033144
4098,b6je,Kazo (Suntec City Mall),Cakes,5.0,11,Singapore,Suntec City Mall Singapore,,1.2950172000000002,103.8578481941785
4099,t1y2,ABC FOOD COURT (532 AMK AVE 10),Indian,2.5,38,Singapore,532 AMK AVE 10 Singapore,20.0,,
4100,ccip,Fragrance Wok Fish Head Steamboat (Kim Heng Coffee Shop) - Islandwide Delivery,Chinese,3.1,7,Singapore,Kim Heng Coffee Shop Singapore,,,
4101,hjum,JUwei 聚味-江湖菜馆 (29 Carpenter St),Chinese,3.5,32,Singapore,29 Carpenter St Singapore,,1.2881877,103.8474069109848
4102,v2lw,Kooks Creamery (Serangoon Ave),Dessert,4.8,100,Singapore,Serangoon Ave Singapore,12.0,1.3497610500000001,103.87368414801405
4103,z1b5,Halal Western (Nanyang Polytechnic),Western,4.0,1,Singapore,Nanyang Polytechnic Singapore,,1.38072165,103.848776833223
4104,jbwj,7 DAYS THAI FOOD (Leng Kee Road),Thai,3.7,3,Singapore,Leng Kee Road Singapore,,1.2905097,103.81382145
4105,lgwh,IVINS Peranakan Restaurant (21 Binjai Park) - Islandwide Delivery,Singaporean,4.9,7,Singapore,21 Binjai Park Singapore,,1.33636365,103.78688806201552
4106,dw95,Three Amigos Mexican and Indian Cuisine (Boat Quay),Indian,2.8,4,Singapore,Boat Quay Singapore,,1.287444215693743,103.84936651633177
4107,vwgw,Si Ya Foods Mala Hotpot (South Canteen),Asian,4.3,4,Singapore,South Canteen Singapore,,1.3780771,103.8493526
4108,fdk3,Genesis Vegan Restaurant (Havelock 2),Vegetarian,4.9,27,Singapore,Havelock 2 Singapore,,1.2871869,103.84518153700975
4109,zdnu,The Living Room Eating House (Lengkok Bahru) - Islandwide Delivery,Chinese,4.0,1,Singapore,Lengkok Bahru Singapore,,1.2867215091213036,103.81119374705304
4110,a0j3,Rong Cheng Mala Xiang Guo (Ang Mo Kio Avenue 4),Mala Soups,2.2,3,Singapore,Ang Mo Kio Avenue 4 Singapore,20.0,1.3739996706332946,103.83737730338107
4111,vkxd,Chelabela (Ang Mo Kio Avenue 5),Japanese,5.0,44,Singapore,Ang Mo Kio Avenue 5 Singapore,20.0,1.37598685,103.852695
4112,g9dj,Gully (Hongkong Street) (pandago),Greek,2.1,26,Singapore,Hongkong Street Singapore,,1.2871683076030234,103.84800861566546
4113,plar,Mikkame (Havelock 2),Rice Dishes,5.0,4,Singapore,Havelock 2 Singapore,,1.2871869,103.84518153700975
4114,t8d7,Sembarang Nasi Lemak Padang (63B Lengkok Bahru),Nasi Lemak,4.7,5,Singapore,63B Lengkok Bahru Singapore,,1.2892428,103.81554423916955
4115,s3xn,The Bakery Chef (2 Havelock Rd),Singaporean,4.7,100,Singapore,2 Havelock Rd Singapore,,1.2871869,103.84518153700975
4116,x6si,Amò (Hong kong Street),Pizza,4.4,98,Singapore,Hong kong Street Singapore,,1.2875550103283657,103.84736469164056
4117,hnsa,Austin ( Boon Tiong Rd),Western,4.1,51,Singapore, Boon Tiong Rd Singapore,,1.2864530099721647,103.83113247882355
4118,y2fl,Thye Guan Fragrant Hot Pot (Koufu Tanglin Halt),Mala Xiang Guo,4.0,500,Singapore,Koufu Tanglin Halt Singapore,10.0,1.3017903,103.7983116
4119,y2jm,Yun Seafood Fish Head Steamboat (Ang Mo Kio),Seafood,4.2,75,Singapore,Ang Mo Kio Singapore,20.0,1.369842,103.8466086
4120,xvuj,A&A Cafe & Bistro (Havelock 2),Sandwiches,2.3,7,Singapore,Havelock 2 Singapore,,1.2871869,103.84518153700975
4121,v2tz,Macpherson BBQ Seafood (South Bridge),Chinese,4.5,500,Singapore,South Bridge Singapore,,1.2847354,103.8468356
4122,r7jn,Qi Lai Feng  齐来丰 (Geylang Road),Chinese,5.0,3,Singapore,Geylang Road Singapore,14.0,1.31241245,103.8779448
4123,a0gk,NYP Chicken Rice (Nanyang Polytechnic),Chicken,4.5,100,Singapore,Nanyang Polytechnic Singapore,,1.38072165,103.848776833223
4124,rcbe,Sonny’s Pizzeria (Circular Road),Pizza,4.6,72,Singapore,Circular Road Singapore,,1.286438987899482,103.84911907870797
4125,x1nr,Tom Yum Kungfu (Circular Road),Thai,4.9,72,Singapore,Circular Road Singapore,,1.286438987899482,103.84911907870797
4126,v6tq,Al-Amin Food Paradise (Holland Village),Indian,4.2,2000,Singapore,Holland Village Singapore,10.0,1.3126017,103.7971262
4127,kf34,espresso.doc (Chan Brother @ 68),Coffee,4.9,15,Singapore,Chan Brother @ 68 Singapore,,,
4128,qy81,Fortune Thai Kitchen (People's Park Center),Thai,3.0,30,Singapore,People's Park Center Singapore,1.0,,
4129,d7qv,Sha Xian Xiao Chi沙县小吃 (Geylang Road）,Chinese,3.6,5,Singapore,,,46.3144754,11.0480288
4130,pnuz,Pizza Arc (Nanyang Polytechnic),Italian,5.0,1,Singapore,Nanyang Polytechnic Singapore,,1.38072165,103.848776833223
4131,s7rp,Tandoori Zaika (INDIAN CUISINE),Indian,4.0,100,Singapore,INDIAN CUISINE Singapore,,1.2832042,103.8457466
4132,s9hd,Aroy Mak Mookata (Macpherson Road) (pandago),Thai,4.6,34,Singapore,Macpherson Road Singapore,13.0,1.32620695,103.88950695393876
4133,x8mw,"Faith Nasi Lemak, Fried Bee Hoon & Mee (Redhill Lane)",Singaporean,4.4,1000,Singapore,Redhill Lane Singapore,,1.28667525,103.81873200000001
4134,lf7o,Viet’Spice (Circular Road),Vietnamese,4.4,77,Singapore,Circular Road Singapore,,1.286438987899482,103.84911907870797
4135,x9wi,Dum Pukht Grill & Curry (Indian House),Indian,3.9,64,Singapore,Indian House Singapore,,1.2869409,103.8493875
4136,btx1,AK Zai Lok Lok + Hey Brew Cafe and Bar (Outram Road),Asian,4.5,27,Singapore,Outram Road Singapore,,1.280132051510667,103.83953171090924
4137,zz32,RBL Burgers (Redhill),Western,1.0,1,Singapore,Redhill Singapore,,1.2896482,103.8167677
4138,le95,Victoria Bakery (Marina Square),Dim Sum ,3.9,4,Singapore,Marina Square Singapore,1.0,1.29071265,103.85834537056982
4139,y3ty,The Japanese Food Alley (Holland Avenue),Seafood,4.7,83,Singapore,Holland Avenue Singapore,10.0,1.3087962499999999,103.7950227
4140,g6ym,Sun Ray Cafe (Brighton Cres),Western,4.5,500,Singapore,Brighton Cres Singapore,,1.3618356999999999,103.8701394
4141,smff,Thirteen BBQ Bar (Geylang Rd),Chinese,4.2,69,Singapore,Geylang Rd Singapore,14.0,1.31241245,103.8779448
4142,v9jk,Ming Li Eating House (Sims Avenue),Chinese,4.5,500,Singapore,Sims Avenue Singapore,14.0,1.3129698,103.87439725
4143,t6fd,Richie's Puff & Cafe (Tanglin Halt Road),Asian,4.5,100,Singapore,Tanglin Halt Road Singapore,10.0,1.29837941055076,103.7991714
4144,x7dn,Faith & Aaron Mini Hotpot (Redhill),Singaporean,4.9,86,Singapore,Redhill Singapore,,1.2896482,103.8167677
4145,cspn,The Coco Rice (Seng Poh Road),Nasi Lemak,2.7,23,Singapore,Seng Poh Road Singapore,,1.2847650000000002,103.83278340000001
4146,j81v,Punch (North Canal),Sandwiches,4.9,46,Singapore,North Canal Singapore,,,
4147,cohe,Haldi - The Taste Of India (Boat Quay),Indian,3.0,9,Singapore,Boat Quay Singapore,,1.287444215693743,103.84936651633177
4148,k2wf,Old Shifu Charcoal Porridge (Tiong Bahru),Porridge,4.2,500,Singapore,Tiong Bahru Singapore,3.0,1.28617925,103.82722523285841
4149,s4og,P.Osh (Kovan),Dessert,4.8,100,Singapore,Kovan Singapore,,1.3601757,103.88511197287917
4150,hi2o,Hua Fatt Coffee & Toast (AMK 628 Hawker Centre),Asian,4.8,12,Singapore,AMK 628 Hawker Centre Singapore,20.0,,
4151,smoo,Super Shiok Nasi Lemak (Tiong Bahru),Nasi Lemak,4.4,100,Singapore,Tiong Bahru Singapore,3.0,1.28617925,103.82722523285841
4152,s3wd,Coq & Balls (kim Tian Road),Western,4.2,100,Singapore,kim Tian Road Singapore,,1.2839284499999999,103.82944764999999
4153,x2av,BBQ Friend (Lim Tua Tow Road),Korean,3.9,100,Singapore,Lim Tua Tow Road Singapore,,1.3550732,103.87589415
4154,x5yo,Chen Mei Shi Lorong Mee (Tanglin Halt Road),Noodles,4.5,100,Singapore,Tanglin Halt Road Singapore,10.0,1.29837941055076,103.7991714
4155,y1bh,Little Elephant SG Thai Bistro (Eng Hoon),Thai,4.8,100,Singapore,Eng Hoon Singapore,,1.2845862499999998,103.8334109
4156,b6i9,Xin Lao You Ji Fishhead Steamboat Seafood Restaurant (Outram Road),Asian,4.9,45,Singapore,Outram Road Singapore,,1.280132051510667,103.83953171090924
4157,c6ku,Le Le Pot (Seng Poh),Chinese,4.2,59,Singapore,Seng Poh Singapore,,1.2836978,103.83119256255628
4158,ay52,Ju Bin Yuan 聚宾园 (Geylang),Chinese,3.7,25,Singapore,Geylang Singapore,14.0,1.3181862,103.8870563
4159,kfgy,Tongue Thai'D (Kai Fook Mansion),Thai,3.0,13,Singapore,Kai Fook Mansion Singapore,,,
4160,yzud,Sushi-GO (Marina Square),Japanese,3.8,5,Singapore,Marina Square Singapore,1.0,1.29071265,103.85834537056982
4161,zd0y,Lucky Saigon (17 North Canal Rd) - Islandwide Delivery,Vietnamese,3.3,15,Singapore,17 North Canal Rd Singapore,,1.28642675,103.8483967314219
4162,g4vi,Straits Chinese Nonya Restaurant (Esplanade Mall),Singaporean,3.0,7,Singapore,Esplanade Mall Singapore,,1.289907,103.8561231
4163,s9zt,Tong Fu Ju Sichuan Restaurant (Boat Quay),Chinese,4.0,100,Singapore,Boat Quay Singapore,,1.287444215693743,103.84936651633177
4164,d0gv,Kohaku Sabo (133 New Bridge Road),Japanese,5.0,2,Singapore,133 New Bridge Road Singapore,,1.28519745,103.8449051848437
4165,x4os,Lucky Seafood Restaurant (Sims Avenue),Seafood,4.3,100,Singapore,Sims Avenue Singapore,14.0,1.3129698,103.87439725
4166,kxzr,Tea Wiches (ITE College Central),Sandwiches,4.0,21,Singapore,ITE College Central Singapore,,1.37807045,103.85621082423187
4167,g3uu,Zi Yean Restaurant (Lengkok Bahru),Chinese,4.4,100,Singapore,Lengkok Bahru Singapore,,1.2867215091213036,103.81119374705304
4168,y6zp,He Ping Claypot Rice Restaurant (Sims Avenue),Chinese,4.3,100,Singapore,Sims Avenue Singapore,14.0,1.3129698,103.87439725
4169,stv4,Kim's Singapore  (Circular Road),Hokkien Mee,3.6,65,Singapore,Circular Road Singapore,,1.286438987899482,103.84911907870797
4170,p1qh,Kook Kai Thaifood (238 Geylang Rd),Thai,4.3,100,Singapore,238 Geylang Rd Singapore,14.0,1.3119694,103.87632385
4171,mkgp,Masa-lah House (79 Circular Rd),Indian,1.0,1,Singapore,79 Circular Rd Singapore,,1.2869329999999999,103.84885267560944
4172,w8cb,Lucky Cafe (North Canal),Chinese,4.6,3000,Singapore,North Canal Singapore,,,
4173,x3nf,Indian Multi Cuisine Restaurant (Indian House),Indian,4.4,100,Singapore,Indian House Singapore,,1.2869409,103.8493875
4174,y7yw,Pin Sheng Teochew Bak Chor Mee (Eng Hoon Street),Chinese,4.7,100,Singapore,Eng Hoon Street Singapore,,1.2845862499999998,103.8334109
4175,mu62,Omoomo Food Concepts (Kallang) - Islandwide Delivery,Japanese,1.0,1,Singapore,Kallang Singapore,,1.310759,103.866262
4176,y5ug,Xiao Jiang Lv Mala Hotpot 小酱驴麻辣香锅 (Nanyang Polytechnic),Mala Xiang Guo,4.9,9,Singapore,Nanyang Polytechnic Singapore,,1.38072165,103.848776833223
4177,w8lb,High Street Tai Wah Pork Noodles (Hong Lim Market & Food Centre),Ban Mian,4.3,100,Singapore,Hong Lim Market & Food Centre Singapore,,1.28530335,103.845821859097
4178,atql,Bao Tian Xia (People's Park Complex) - Islandwide Delivery,Dim Sum ,5.0,4,Singapore,People's Park Complex Singapore,1.0,1.28413865,103.84255695900956
4179,ya9c,古月面 - The Noodle Memories (Hong Lim Market & Food Centre),Noodles,5.0,43,Singapore,Hong Lim Market & Food Centre Singapore,,1.28530335,103.845821859097
4180,x6ig,Tiong Bahru Yong Tao Hu (Eng Hoon Street),Yong Tau Foo,4.6,100,Singapore,Eng Hoon Street Singapore,,1.2845862499999998,103.8334109
4181,x8qj,Foodcoholic (Raffles Place),Indian,3.9,100,Singapore,Raffles Place Singapore,1.0,1.2835416999999998,103.85146023266938
4182,zw71,Hot Shotz (Canton Street),American,3.6,60,Singapore,Canton Street Singapore,,1.2864033409521143,103.84961135601581
4183,a7d1,Quick Muthu (Indian curry rice) (531A UPPER CROSS STREET),Indian,5.0,1,Singapore,Indian curry rice Singapore,,,
4184,al4c,Deadfall Hawkeria (16 North Canal),International,5.0,2,Singapore,16 North Canal Singapore,,,
4185,y4ve,Chicken Haven (2 Ang Mo Kio Dr),Chicken,4.6,100,Singapore,2 Ang Mo Kio Dr Singapore,20.0,1.3775869,103.8563216
4186,qgw9,The Shelter (150 South Bridge Rd),Western,5.0,1,Singapore,150 South Bridge Rd Singapore,,1.28497185,103.84643248598806
4187,w9yq,Juicecare (Bukit Merah View Market & Hawker Centre),Beverages,4.5,26,Singapore,Bukit Merah View Market & Hawker Centre Singapore,,,
4188,t8mn,Pizza D'France (Upper Serangoon Shopping Centre) - Islandwide Delivery,Pizza,5.0,11,Singapore,Upper Serangoon Shopping Centre Singapore,12.0,1.3536587,103.87882277401201
4189,zziq,Gustopizze (Sims Urban Oasis),Pizza,4.3,5,Singapore,Sims Urban Oasis Singapore,14.0,1.3197377000000001,103.88094579533436
4190,j3ib,Boon Cafe (ITE College Central) - Islandwide Delivery,International,5.0,2,Singapore,ITE College Central Singapore,,1.37807045,103.85621082423187
